ID,Date Reported,Description,Attack,Country,Link
132,14/03/23,"Researchers from ESET disclose a campaign by the notorious Chinese cyberespionage group known as Tick, targeting a data loss prevention (DLP) company that serves military and other government organizations.",Targeted Attack,N/A,Link
133,14/03/23,"Marshall, a British amplifier and speaker-cabinet maker, is added to the victim list of ransomware gang Black Basta’s dark-web blog.",Malware,UK,Link
134,14/03/23,"Researchers from Cyble discover GoatRAT, an Android banking Trojan targeting Brazilian banks.",Malware,BR,Link
135,14/03/23,"NorthStar Emergency Medical Services discloses a breach that might have given bad actors access to the records of more than 80,000 current and former patients.",Unknown,US,Link
136,14/03/23,Voya Financial Advisors (VFA) files a notice of data breach after learning that sensitive consumer information stored on the company’s computer system was accessible to an unauthorized party.,Account Takeover,US,Link
137,14/03/23,"Kernelware postes data from PetroVietnam, a state-owned oil and gas group.",Unknown,VN,Link
138,14/03/23,Kernelware posts data from Long Son Petrochemicals,Unknown,VN,Link
139,14/03/23,Kernelware postes data from POSCO Engineering & Construction.,Unknown,VN,Link
140,14/03/23,A threat actor leaks some data allegedly stolen from the Italian engineering company Fincantieri. A subsequent analysis reveals that the data was stolen from a third party.,Account Takeover,IT,Link
141,15/03/23,"Researchers from Crowdstrike discover The first known cryptojacking operation mining the Dero coin, targeting vulnerable Kubernetes container orchestrator infrastructure with exposed APIs.",Misconfiguration,>1,Link
142,15/03/23,"The CISA, FBI, and MS-ISAC reveal that a U.S. federal agency's Microsoft Internet Information Services (IIS) web server was hacked by exploiting a critical .NET deserialization vulnerability in the Progress Telerik UI for ASP.NET AJAX component.",CVE-2019-18935 vulnerability,US,Link
143,15/03/23,"CISA adds CVE-2023-26360, a critical vulnerability impacting Adobe ColdFusion versions 2021 and 2018, to its catalog of security bugs exploited in the wild.",CVE-2023-26360 Vulnerability,US,Link
144,15/03/23,A convincing Twitter scam is targeting bank customers by abusing the quote-tweet feature.,Account Takeover,>1,Link
145,15/03/23,"Researchers from Avast reveal that cybercriminals are abusing Adobe Acrobat Sign, an online document signing service, to distribute the redline info-stealing malware to unsuspecting users.",Malware,>1,Link
146,15/03/23,"An unknown hacker offers up a cache of 60GB of sensitive files, allegedly stolen from Deutsche Bank by the infamous LockBit ransomware gang.",Unknown,DE,Link
147,15/03/23,"Researchers from WithSecure discover a threat activity clusters affiliated with the Chinese and Russian cybercriminal ecosystems using SILKLOADER, a new piece of malware designed to load Cobalt Strike onto infected machines.",Malware,BR FR TW,Link
148,15/03/23,"Researchers from Check Point discover a new piece of malware dubbed dotRunpeX used to distribute numerous known malware families such as Agent Tesla, Ave Maria, BitRAT, FormBook, LokiBot, NetWire, Raccoon Stealer, RedLine Stealer, Remcos, Rhadamanthys, and Vidar.",Malware,>1,Link
149,15/03/23,Kroger Postal Prescription Services (Kroger PPS) files a notice of data breach after learning that confidential consumer information in the company’s possession was subject to unauthorized access.,Unknown,US,Link
150,15/03/23,The Health Sector Cybersecurity Coordination Center (HC3) issues a warning regarding the Black Basta ransomware group targeting the Healthcare sector.,Malware,US,Link
151,15/03/23,"A forum user on BreachForums lists data from the HLA Grupo Hospitalario in Spain for sale. The listing advertises 45,000 patient records and information on 1,600 doctors, with samples provided of each.",Misconfiguration,ES,Link
152,15/03/23,Autoridad de Acueductos y Alcantarillados (AAA) confirms it suffered a ransomware attack. The attack reportedly affects AAA’s electronic customer service systems.,Malware,PR,Link
153,15/03/23,"An attacker steals $390,000 from cross-chain platform Poolz Finance",Vulnerability,N/A,Link
154,15/03/23,The Municipality of Taggia in Italy is hit with a cyber attack.,Malware,IT,Link
155,15/03/23,Researchers from ReliaQuest discover a new campaign using Qbot distributing the Black Basta ransomware.,Malware,N/A,Link
156,15/03/23,Merritt Healthcare Advisors reports a phishing attack that exposed the data of some of its healthcare clients.,Account Takeover,US,Link