"ID","Date Reported","Date Occurred","Date Discovered","Author","Target","Description","Attack","Target Class","Attack Class","Country","Link"
"78","24/04/2024","15/04/2024","-","Medusa","Northeast Ohio Neighborhood Health","The Medusa ransomware group claims responsibility for a cyberattack on the servers of Northeast Ohio Neighborhood Health (NEON), a company providing healthcare services, and the exfiltration of nearly 51GB of data.","Ransomware","Human health and social work","Cyber Crime","US","Link"
"79","24/04/2024","-","-","?","Organizations in the education and government sectors in the U.S.","Researchers from Veriti discover a campaign targeting the education and government sectors in the U.S. through the Agent Tesla and Taskun malware.","Malware","Multiple Industries","Cyber Crime","US","Link"
"80","24/04/2024","-","-","?","Multiple organizations","Researchers from Securonix reveal the details of FROZEN#SHADOW, an ongoing campaign that's leveraging phishing emails to deliver the SSLoad malware.","Malware","Multiple Industries","Cyber Crime",">1","Link"
"81","25/04/2024","-","-","?","Android users","Researchers from ThreatFabric discover a new Android banking trojan named Brokewell that can capture every event on the device, from touches and information displayed to text input and the applications the user launches.","Malware","Individual","Cyber Crime",">1","Link"
"82","25/04/2024","Toward the end of 2023","Toward the end of 2023","?","Government entities in Ukraine","Researchers from Deep Instinct reveal that an unknown threat actor targeted government entities in Ukraine toward the end of 2023 using an old Microsoft Office remote code execution (RCE) exploit from 2017 (CVE-2017-8570) as the initial vector and military vehicles as the lure.","Targeted Attack","Public admin and defence, social security","Cyber Espionage","UA","Link"
"83","25/04/2024","-","-","?","Users of dating websites and applications in the U.S.","The FBI publishes a warning about cyber criminals taking advantage of people’s fears about online dating by getting them to download fake “verification” sites that allow them to steal information and money.","Account Takeover","Individual","Cyber Crime","US","Link"
"84","25/04/2024","During the 2023 holiday season","During the 2023 holiday season","?","Individuals in the U.S.","Researchers from Akamai uncover a significant amount of highly likely malicious activity and domains purporting to be associated with the United States Postal Service (USPS).","Account Takeover","Individual","Cyber Crime","US","Link"
"85","25/04/2024","-","-","Belarusian Cyber-Partisans","Belarus’ main security service agency (KGB)","The website of Belarus’ main security service agency (KGB) has reportedly been down for two months following a cyberattack by Belarusian politically motivated threat actors.","Unknown","Public admin and defence, social security","Hacktivism","BY","Link"
"86","25/04/2024","Since late March 2024","Since late March 2024","KageNoHitobito","Organizations in Chile, China, Cuba, Germany, Iran, Lithuania, Peru, Romania, Sweden, Taiwan, the United Kingdom, and the United States","Researchers from Fortinet reveal the details of KageNoHitobito, a new ransomware strain targeting Windows users across various countries.","Ransomware","Multiple Industries","Cyber Crime","CL CN CU DE GB IR LT PE RO SE TW US","Link"
"87","25/04/2024","19/02/2024","-","?","Los Angeles County Department of Health Services","​The Los Angeles County Department of Health Services discloses a data breach after thousands of patients' personal and health information was exposed in a phishing attack impacting over two dozen employees.","Account Takeover","Human health and social work","Cyber Crime","US","Link"
"88","25/04/2024","12/09/2023","02/04/2024","?","Berry, Dunn, McNeil & Parker","Berry, Dunn, McNeil & Parker, a consulting firm with a medical data analytics business notifies more than 1 million individuals that threat actors stole their information from company servers.","Unknown","Professional, scientific and technical","Cyber Crime","US","Link"
"89","26/04/2024","14/02/2024","26/02/2024","?","Financial Business and Consumer Solutions","Financial Business and Consumer Solutions (FBCS) warns initially 1,955,385 impacted individuals in the United States that the company suffered a data breach after discovering unauthorized access to specific systems in its network. One month later the company says over 3.2 million people have been impacted.","Unknown","Finance and insurance","Cyber Crime","US","Link"
"90","26/04/2024","01/03/2024","09/02/2024","?","California Statewide Automated Welfare System","The California Statewide Automated Welfare System discloses that more than 19,000 online accounts may have been accessed by threat actors for nearly a year.","Account Takeover","Human health and social work","Cyber Crime","US","Link"
"91","26/04/2024","18/01/2024","13/03/2024","?","Designed Receivable Solutions","Designed Receivable Solutions (DRS), confirms the details of a data breach affecting 585,204 individuals.","Unknown","Professional, scientific and technical","Cyber Crime","US","Link"
"92","26/04/2024","15/04/2024","15/04/2024","?","Coffee County","Coffee County is hit with a cyber attack.","Unknown","Public admin and defence, social security","Cyber Crime","US","Link"
"93","27/04/2024","-","-","North Korean threat actors","Developers in multiple countries","Researchers from Securonix uncover a new ongoing social engineering attack campaign, tracked as DEV#POPPER, likely associated with North Korean threat actors, targeting developers using fake interviews to deliver a Python-based RAT.","Targeted Attack","Multiple Industries","Cyber Espionage",">1","Link"
"94","27/04/2024","From 19/04/2024 to 26/04/2024","From 19/04/2024 to 26/04/2024","?","Multiple organizations","Researchers from Okta observe a spike in credential stuffing activity against user accounts of online services.","Account Takeover","Multiple Industries","Cyber Crime",">1","Link"
"95","28/04/2024","28/04/2024","28/04/2024","LockBit","London Drugs","​Canadian pharmacy chain London Drugs closes all its retail stores to contain what it described as a ""cybersecurity incident."" One month later the LockBit ransomware operation claims responsibility for the attack.","Ransomware","Human health and social work","Cyber Crime","CA","Link"
"96","29/04/2024","'Recently'","'Recently'","?","Multiple organizations","Researchers from McAfee uncover a novel infection chain associated with DarkGate malware, commencing with an HTML-based entry point and progressing exploiting the AutoHotkey utility in its subsequent stages.","Malware","Multiple Industries","Cyber Crime",">1","Link"
"97","29/04/2024","Since October 2019","During September 2023","Muddling Meerkat","Multiple organizations","Researchers from Infoblox discover a new cluster of activity tracked as ""Muddling Meerkat"", believed to be linked to a Chinese state-sponsored threat actor's manipulation of DNS to probe networks globally.","DNS Manipulation","Multiple Industries","N/A",">1","Link"
"98","29/04/2024","18/04/2024","Between 18/04/2024 and 22/04/2024","?","Android users","Researchers from QAX discover a new Android backdoor malware named 'Wpeeper' in at least two unofficial app stores mimicking the Uptodown App Store, a popular third-party app store for Android devices with over 220 million downloads. The malware uses compromised WordPress sites to act as relays for its actual command and control (C2) servers, acting as an evasion mechanism.","Malware","Individual","Cyber Crime","N/A","Link"
"99","29/04/2024","-","-","?","Android users","Researchers from SonicWall discover malicious Android apps masquerading as Google, Instagram, Snapchat, WhatsApp, and X (formerly Twitter) aimed to steal users' credentials from compromised devices.","Malware","Individual","Cyber Crime",">1","Link"
"100","29/04/2024","-","-","?","Multiple organizations","Researchers from Inky discover a phishing campaign using Rich Text Format (RTF) attachment files to harvest Microsoft credentials.","Account Takeover","Multiple Industries","Cyber Crime",">1","Link"
"101","29/04/2024","26/04/2024","26/04/2024","Ukraine’s military intelligence agency, the GUR","United Russia","Ukraine’s military intelligence agency, the GUR, launches a DDoS attack against the website of Russia's ruling party United Russia.","DDoS","Other service activities","Cyber Warfare","RU","Link"
"102","29/04/2024","25/04/2024","25/04/2024","?","Kansas City Scout System","The Kansas City Scout System is taken down by a cyberattack.","Unknown","Transportation and storage","Cyber Crime","US","Link"
"103","29/04/2024","During April 2024","During April 2024","Russia","Estonia and Lithuania","State officials from Lithuania and Estonia blame Russia for GPS jamming of commercial flights.","GPS Jamming","Transportation and storage","Cyber Warfare","EE LT","Link"
"104","30/04/2024","Since 2021","Since 2021","?","Multiple organizations","Security researchers at JFrog identify three large-scale campaigns targeting Docker Hub with repositories that did not contain container images but featured malicious metadata instead.","Malware","Multiple Industries","Cyber Crime",">1","Link"
"105","30/04/2024","-","-","?","Multiple organizations","A new campaign distributes the Latrodectus (a.k.a. Unidentified 111 and IceNova) malware using Microsoft Azure and Cloudflare lures to appear legitimate.","Malware","Multiple Industries","Cyber Crime",">1","Link"
"106","30/04/2024","07/03/2024","10/03/2024","?","Panda Restaurant Group","Panda Restaurant Group discloses a data breach after threat actors compromised its corporate systems and stole the personal information of an undisclosed number of associates.","Unknown","Accommodation and food service","Cyber Crime","US","Link"
"107","30/04/2024","Since at least 24/04/2024","24/04/2024","?","Multiple organizations","Researchers from Kanji discover Cuckoo, a new information stealer targeting Apple macOS systems that's designed to set up persistence on the infected hosts and act as a spyware.","Malware","Multiple Industries","Cyber Crime",">1","Link"