"ID","Date Reported","Date Occurred","Date Discovered","Author","Target","Description","Attack","Target Class","Attack Class","Country","Link"
"157","29/06/2023","05/04/2023","-","?","Delaware Health Net","The Henrietta Johnson Medical Center postes notice that some patient data was involved in a breach at Delaware Health Network (DHN), a healthcare-controlled network provider and electronic health records management provider that provides services to Henrietta Johnson Medical Center (HJMC) and other entities.","Unknown","Professional, scientific and technical","Cyber Crime","US","Link"
"158","29/06/2023","27/05/2023","12/06/2023","Rhysida","Lumberton ISD","The Lumberton Independent School District is hit with a Rhysida ransomware attack.","Malware","Education","Cyber Crime","US","Link"
"159","29/06/2023","'Recently'","'Recently'","Cyclops","Atherfield Medical & Skin Cancer Clinic","A relatively new ransomware group, Cyclops, claims to have attacked Atherfield Medical & Skin Cancer Clinic in Australia:","Malware","Human health and social work","Cyber Crime","AU","Link"
"160","29/06/2023","-","-","Clop AKA Lace Tempest, TA505 and, FIN11","Talcott Resolution Life Insurance Company","Talcott Resolution Life Insurance Company is listed among the victims of the Cl0p ransomware gang exploiting the CVE-2023-34362 Vulnerability.","CVE-2023-34362 Vulnerability","Finance and insurance","Cyber Crime","US","Link"
"161","29/06/2023","-","-","Clop AKA Lace Tempest, TA505 and, FIN11","University of Southern Illinois","The University of Southern Illinois is listed among the victims of the Cl0p ransomware gang exploiting the CVE-2023-34362 Vulnerability.","CVE-2023-34362 Vulnerability","Education","Cyber Crime","US","Link"
"162","29/06/2023","15/06/2023","15/06/2023","?","Lebanon School District","The Lebanon School District is hit by a ransomware attack.","Malware","Education","Cyber Crime","LB","Link"
"163","30/06/2023","-","29/06/2023","LockBit 3.0","Kinmax Technology","Taiwan Semiconductor Manufacturing Company (TSMC), the world’s largest contract chipmaker, confirms it’s experienced a data breach after being listed as a victim by the LockBit ransomware gang. However the Ransomware gang hit one of the company’s IT hardware suppliers, named as Kinmax Technology.","Malware","Professional, scientific and technical","Cyber Crime","TW","Link"
"164","30/06/2023","Since 26/06/2023","Since 26/06/2023","Anonymous Sudan","EFTPS.gov (U.S. Treasury Department's Electronic Federal Tax Payment System)","The U.S. Cybersecurity and Infrastructure Security Agency (CISA) warns of ongoing distributed denial-of-service (DDoS) attacks after U.S. organizations across multiple industry sectors are hit.","DDoS","Public admin and defence, social security","Hacktivism","US","Link"
"165","30/06/2023","Since 26/06/2023","Since 26/06/2023","Anonymous Sudan","U.S. Commerce Department","Anonymous Sudan claims to have taken down the website of the U.S. Commerce Department.","DDoS","Public admin and defence, social security","Hacktivism","US","Link"
"166","30/06/2023","30/06/2023","30/06/2023","Anonymous Sudan","Stripe","Anonymous Sudan also claims responsibility for another DDoS attack that targeted Stripe's dashboard for managing business payments, refunds, and operations.","DDoS","Professional, scientific and technical","Hacktivism","IE US","Link"
"167","30/06/2023","'Recently'","'Recently'","ALPHV AKA BlackCat","Multiple organizations","Researchers from Trend Micro discover a malvertising campaign from the BlackCat ransomware gang to lure people into fake pages that mimic the official website of the WinSCP file-transfer application for Windows but instead push malware-ridden installers.","Malware","Multiple Industries","Cyber Crime",">1","Link"
"168","30/06/2023","-","-","?","Pearson Edexcel","Cambridgeshire Police says they are in the “early stages” of investigating a “data breach” involving exam boards Pearson Edexcel.","Unknown","Education","Cyber Crime","GB","Link"
"169","30/06/2023","-","-","?","OCR","Cambridgeshire Police says they are also investigating a “data breach” involving exam boards OCR","Unknown","Education","Cyber Crime","GB","Link"
"170","30/06/2023","-","-","?","AOA","Police are also investigating a cyber-attack at England’s largest exam board AQA, the third board to be targeted.","Unknown","Education","Cyber Crime","GB","Link"
"171","30/06/2023","'Recently'","'Recently'","Meduza Stealer","Multiple organizations","Researchers from Uptycs discover Meduza Stealer, a new Windows-based information stealer actively being developed by its author to evade detection by software solutions and targeting 19 password manager apps, 76 crypto wallets, 95 web browsers, Discord, Steam.","Malware","Multiple Industries","Cyber Crime",">1","Link"
"172","30/06/2023","During June 2023","During June 2023","?","Multiple organizations","Researchers from Inky discover a phishing campaign embedding QR codes into their bodies to avoid detection.","Account Takeover","Multiple Industries","Cyber Crime",">1","Link"
"173","30/06/2023","'Recently'","'Recently'","ALPHV AKA BlackCat","Multiple organizations","Researchers from Trend Micro discover a new campaign by the ALPHV/BlackCat ransomware gang, mimicking the website of a well-known Windows application WinSCP, distributed via malvertising, to infect victims.","Malware","Multiple Industries","Cyber Crime",">1","Link"
"174","30/06/2023","-","-","Clop AKA Lace Tempest, TA505 and, FIN11","Maryland's Department of Health and Human Services","The Maryland's Department of Health and Human Services is listed among the victims of the Cl0p ransomware gang exploiting the CVE-2023-34362 Vulnerability.","CVE-2023-34362 Vulnerability","Human health and social work","Cyber Crime","US","Link"
"175","30/06/2023","'Recently'","'Recently'","Clop AKA Lace Tempest, TA505 and, FIN11","United Bank","United Bank files a notice regarding a data breach within a third-party software tool. It is suspected that the breach involves the CVE-2023-34362 vulnerability in MOVEit.","CVE-2023-34362 Vulnerability","Finance and insurance","Cyber Crime","US","Link"
"176","30/06/2023","11/02/2023","-","?","Gates Corporation","Gates Corporation files a notice of data breach after confirming that the company was the victim of a ransomware attack.","Malware","Manufacturing","Cyber Warfare","US","Link"
"177","30/06/2023","20/01/2023 and 28/02/2023","20/01/2023","?","Imagine360","Imagine360 files a notice of data breach after discovering two data breaches at third-party vendors, both involving two different file transfer software programs (Citrix and Fortra).","Vulnerability","Finance and insurance","Cyber Crime","US","Link"
"178","30/06/2023","-","14/06/2023","Clop AKA Lace Tempest, TA505 and, FIN11","Undisclosed vendor","Clearwater Credit Union files a notice of data breach after discovering the personal information of 25,660 individuals was leaked as a result of the massive MOVEit vulnerability.","CVE-2023-34362 Vulnerability","Unknown","Cyber Crime","US","Link"
"179","30/06/2023","-","14/06/2023","Clop AKA Lace Tempest, TA505 and, FIN11","Undisclosed vendor","Union Bank and Trust Company (UBT) files a notice of data breach after discovering the personal information of 25,660 individuals was leaked as a result of the massive MOVEit vulnerability.","CVE-2023-34362 Vulnerability","Unknown","Cyber Crime","US","Link"
"180","30/06/2023","28/04/2023","04/05/2023","?","Mount Desert Island Hospital","Mount Desert Island Hospital (MDIH) files a notice of data breach after discovering that an unauthorized party had gained access to confidential patient information stored on the company’s computer network.","Unknown","Human health and social work","Cyber Crime","US","Link"
"181","30/06/2023","-","During March 2022","?","ARx Patient Solutions","ARx Patient Solutions files a notice of data breach after discovering that an employee’s M365 email account was accessed by an unauthorized party.","Account Takeover","Administration and support service","Cyber Crime","US","Link"
"182","30/06/2023","-","-","Rhysida","University of Salerno","The University of Salerno is hit with a Rhysida ransomware attack.","Malware","Education","Cyber Crime","IT","Link"
"183","30/06/2023","-","05/06/2023","Clop AKA Lace Tempest, TA505 and, FIN11","Realm IDX","Realm IDX, a diagnostics company, confirms to have suffered a data breach occurred exploiting the MOVEit CVE-2023-34362 vulnerability.","CVE-2023-34362 Vulnerability","Professional, scientific and technical","Cyber Crime","US","Link"
"184","30/06/2023","-","11/05/2023","?","Arizona Health Care Cost Containment System (AHCCCS)","The Arizona Health Care Cost Containment System (AHCCCS) discloses a data breach compromising over 2,000 Medicaid members.","Unknown","Public admin and defence, social security","Cyber Crime","US","Link"
"185","30/06/2023","20/02/2023","03/04/2023","?","South Suburban Surgical Suites","South Suburban Surgical Suites reports a breach of a legacy Microsoft Office 365-hosted business email account.","Account Takeover","Human health and social work","Cyber Crime","US","Link"
"186","30/06/2023","-","28/06/2023","BianLian","Piramal Group","The BianLian Ransomware gang claims responsibility for the alleged Piramal Group cyber attack, listing the Indian business conglomerate as a victim on the ransomware gang’s leak site.","Malware","Other service activities","Cyber Crime","IN","Link"