"ID","Date Reported","Date Occurred","Date Discovered","Author","Target","Description","Attack","Target Class","Attack Class","Country","Link"
"78","23/06/2023","15/12/2022","21/12/2022","?","GeoSouthern Energy Corporation","GeoSouthern Energy Corporation file a notice of data breach after learning that a recent cyberattack compromised confidential information belonging to current and former employees as well as their dependents.","Unknown","Electricity, gas steam, air conditioning","Cyber Crime","US","Link"
"79","23/06/2023","-","02/06/2023","Clop AKA Lace Tempest, TA505 and, FIN11","Harris Health System","Harris Health System notifies patients and employees that some of their protected health information may have been compromised during a cyberattack exploiting the CVE-2023-34362 MOVEit vulnerability.","CVE-2023-34362 Vulnerability","Human health and social work","Cyber Crime","US","Link"
"80","23/06/2023","-","-","Clop AKA Lace Tempest, TA505 and, FIN11","Superannuation Arrangements of the University of London","The Superannuation Arrangements of the University of London warns of a data breach occurred after the Cl0p ransomware gang exploited the CVE-2023-34362 Vulnerability.","CVE-2023-34362 Vulnerability","Education","Cyber Crime","GB","Link"
"81","23/06/2023","-","-","?","Undisclosed airport","The database of an undisclosed Italian airport with 7.8 million records is on sale in the dark web.","Unknown","Transportation and storage","Cyber Crime","IT","Link"
"82","24/06/2023","-","-","Clop AKA Lace Tempest, TA505 and, FIN11","New York City Department of Education (NYC DOE)","The New York City Department of Education (NYC DOE) says hackers stole documents containing the sensitive personal information of up to 45,000 students from its MOVEit Transfer server.","CVE-2023-34362 Vulnerability","Public admin and defence, social security","Cyber Crime","US","Link"
"83","24/06/2023","-","-","Clop AKA Lace Tempest, TA505 and, FIN11","National Student Clearinghouse (NSC),","The National Student Clearinghouse (NSC) is listed by the Cl0p gang among the victims of a data breach occurred exploiting the MOVEit vulnerability.","CVE-2023-34362 Vulnerability","Public admin and defence, social security","Cyber Crime","US","Link"
"84","24/06/2023","23/06/2023","23/06/2023","SiegedSec","City of Fort Worth","Officials in Fort Worth, Texas, confirm that a website with government information was breached and accessed by a group of hackers but downplayed the severity of the incident.","Unknown","Public admin and defence, social security","Hacktivism","US","Link"
"85","24/06/2023","-","-","Individuals in Ukraine","Citizens of European countries","The Cyber Police of Ukraine raids nine fraudulent call centers that involved more than 200 operators working in the Kyiv and Dnipro regions, posing as bank and other financial institution employees to obtain credit and debit card data.","Account Takeover","Finance and insurance","Cyber Crime","EU","Link"
"86","25/06/2023","SInce at least 24/06/2023","SInce at least 24/06/2023","?","Suncor Energy","Petro-Canada gas stations across Canada are impacted by technical problems preventing customers from paying with credit card or rewards points as its parent company, Suncor Energy, discloses they suffered a cyberattack.","Unknown","Electricity, gas steam, air conditioning","Cyber Crime","CA","Link"
"87","25/06/2023","25/06/2023","25/06/2023","?","Activision Blizzard","A distributed denial-of-service (DDoS) attack targets the servers of Diablo’s developer, Activision Blizzard.","DDoS","Arts entertainment, recreation","Cyber Crime","US","Link"
"88","26/06/2023","Since March 2023","During March 2023","Anatsa","Online banking customers in the U.S., the U.K., Germany, Austria, and Switzerland","Researchers from ThreatFabric discover a new mobile malware campaign pushing the Android banking trojan 'Anatsa' to online banking customers in the U.S., the U.K., Germany, Austria, and Switzerland.","Malware","Finance and insurance","Cyber Crime","AT CH DE GB US","Link"
"89","26/06/2023","31/05/2023","01/06/2023","Clop AKA Lace Tempest, TA505 and, FIN11","Allegiant Air","Allegiant Air confirms that 1,405 people had information accessed through the exploitation of the MOVEit vulnerability.","CVE-2023-34362 Vulnerability","Transportation and storage","Cyber Crime","US","Link"
"90","26/06/2023","-","-","Clop AKA Lace Tempest, TA505 and, FIN11","Jackson National Life Insurance","Jackson National Life Insurance discloses that 700K-800K of its customers were exposed in a  data breach stemming from the exploitation of the MOVEit vulnerability.","CVE-2023-34362 Vulnerability","Finance and insurance","Cyber Crime","US","Link"
"91","26/06/2023","-","15/06/2023","Clop AKA Lace Tempest, TA505 and, FIN11","Corebridge Financial","Corebridge Financial files a notice regarding a data breach resulting from the CVE-2023-34362 vulnerability in MOVEit.","CVE-2023-34362 Vulnerability","Finance and insurance","Cyber Crime","US","Link"
"92","26/06/2023","-","09/05/2023","?","Gary Motykie","Gary Motykie, a plastic surgeon, notifies patients about a cyberattack and data theft incident, when the surgeon was contacted by a cyber threat actor who claimed to have accessed his IT systems and was in possession of sensitive patient information.","Unknown","Human health and social work","Cyber Crime","US","Link"
"93","26/06/2023","Between March and August of 2022","-","?","Barrow County","Barrow County in Georgia issued a breach notice about a breach of its email environment that occurred between March and August of 2022.","Account Takeover","Public admin and defence, social security","Cyber Crime","US","Link"
"94","26/06/2023","-","-","Rhysida","Fassi Gru","The Rhysida ransomware gang adds Fassi Gru to their leak site and claims to be in possession of 490 Gb of data.","Unknown","Manufacturing","Cyber Crime","IT","Link"
"95","26/06/2023","-","-","8Base","Legalilavoro","Legalilavoro, an Italian law firm, suffers a cyber attack from the 8Base ransomware gang.","Unknown","Professional, scientific and technical","Cyber Crime","IT","Link"
"96","26/06/2023","-","19/06/2023","NoEscape","CreditTeam","The criminal gang NoEscape claims responsibility for an attack to the Italian financial provider CreditTeam, and leaks 12.1 Gb of data.","Unknown","Finance and insurance","Cyber Crime","IT","Link"
"97","27/06/2023","-","-","Clop AKA Lace Tempest, TA505 and, FIN11","Siemens Energy","Siemens Energy confirms that data was stolen during the recent Clop ransomware data-theft attacks using the zero-day vulnerability in the MOVEit Transfer platform.","CVE-2023-34362 Vulnerability","Professional, scientific and technical","Cyber Crime","DE","Link"
"98","27/06/2023","-","26/06/2023","Clop AKA Lace Tempest, TA505 and, FIN11","Schneider Electric","The Clop ransomware gang claims to have stolen data from MOVEit Transfer systems of another industry giant, Schneider Electric.","CVE-2023-34362 Vulnerability","Manufacturing","Cyber Crime","FR","Link"
"99","27/06/2023","28/05/2023","-","Clop AKA Lace Tempest, TA505 and, FIN11","University of California, Los Angeles (UCLA)","The Clop ransomware gang claims to have stolen data from MOVEit Transfer systems of the University of California, Los Angeles (UCLA).","CVE-2023-34362 Vulnerability","Education","Cyber Crime","US","Link"
"100","27/06/2023","-","-","Clop AKA Lace Tempest, TA505 and, FIN11","AbbVie","The Clop ransomware gang claims to have stolen data from MOVEit Transfer systems of the biopharmaceutical company AbbVie","CVE-2023-34362 Vulnerability","Professional, scientific and technical","Cyber Crime","US","Link"
"101","27/06/2023","Since at least 27/06/2023","23/06/2023","?","Individuals","Researchers from Bitdefender warn of tailor-made scams exploiting the OceanGate disaster.","Scam","Individual","Cyber Crime",">1","Link"
"102","27/06/2023","27/06/2023","27/06/2023","NoName057(16)","Nearly a dozen major Ukrainian banks","The pro-Russian hacktivists from the NoName057(16) collective take down several banks in Ukraine including four of the nation's largest commercial banks: First Ukrainian International Bank (PUMB), State Savings Bank of Ukraine (Oshchadbank), Credit Agricole Bank, and Universal Bank.","DDoS","Finance and insurance","Hacktivism","UA","Link"
"103","27/06/2023","'Recently'","'Recently'","Wagner","Multiple organizations in Russia","Researchers from Cyble discover a new ransomware variant called Wagner, infecting user devices and inviting them to join the Wagner Group.","Malware","Multiple Industries","Cyber Crime","RU","Link"
"104","27/06/2023","'Recently'","'Recently'","ThirdEye","Multiple organizations","Researchers from Fortinet discover a previously unseen infostealer named “ThirdEye”.","Malware","Multiple Industries","Cyber Crime",">1","Link"
"105","27/06/2023","-","02/11/2022","?","Precision Imaging Centers","Precision Imaging Centers files a notice of data breach after the company discovered that it had been the recent victim of a cyberattack, giving hackers to confidential consumer data.","Unknown","Professional, scientific and technical","Cyber Crime","US","Link"
"106","27/06/2023","17/04/2023","17/04/2023","?","MAC Pizza Management","MAC Pizza Management files a notice of data breach after learning that confidential information belonging to thousands of people was compromised following a ransomware attack.","Malware","Accommodation and food service","Cyber Crime","US","Link"
"107","27/06/2023","-","-","Clop AKA Lace Tempest, TA505 and, FIN11","Maximus","U.S. government contractor Maximus is listed among the victims of the Clop ransomware gang campaign exploiting the MOVEit CVE-2023-34362 Vulnerability.","CVE-2023-34362 Vulnerability","Professional, scientific and technical","Cyber Crime","US","Link"
"108","27/06/2023","-","-","Clop AKA Lace Tempest, TA505 and, FIN11","AmeriSave Mortgage","AmeriSave Mortgage is listed among the victims of the Clop ransomware gang campaign exploiting the MOVEit CVE-2023-34362 Vulnerability.","CVE-2023-34362 Vulnerability","Finance and insurance","Cyber Crime","US","Link"
"109","27/06/2023","-","-","Clop AKA Lace Tempest, TA505 and, FIN11","Agilysys","Agilysys is listed among the victims of the Clop ransomware gang campaign exploiting the MOVEit CVE-2023-34362 Vulnerability.","CVE-2023-34362 Vulnerability","Professional, scientific and technical","Cyber Crime","US","Link"
"110","27/06/2023","-","-","Clop AKA Lace Tempest, TA505 and, FIN11","College of American Pathologists","The College of American Pathologists is listed among the victims of the Clop ransomware gang campaign exploiting the MOVEit CVE-2023-34362 Vulnerability.","CVE-2023-34362 Vulnerability","Other service activities","Cyber Crime","US","Link"
"111","27/06/2023","-","-","Clop AKA Lace Tempest, TA505 and, FIN11","Chuck E. Cheese","Chuck E. Cheese is listed among the victims of the Clop ransomware gang campaign exploiting the MOVEit CVE-2023-34362 Vulnerability.","CVE-2023-34362 Vulnerability","Accommodation and food service","Cyber Crime","US","Link"
"112","27/06/2023","-","-","Clop AKA Lace Tempest, TA505 and, FIN11","Boston Globe","The Boston Globe joins the list of the victims of the Clop ransomware gang campaign exploiting the MOVEit CVE-2023-34362 Vulnerability.","CVE-2023-34362 Vulnerability","Information and communication","Cyber Crime","US","Link"
"113","27/06/2023","-","-","Clop AKA Lace Tempest, TA505 and, FIN11","Datasite","Datasite files a notice of data breach following a third-party data breach occurred exploiting the MOVEit CVE-2023-34362 Vulnerability.","CVE-2023-34362 Vulnerability","Professional, scientific and technical","Cyber Crime","US","Link"
"114","27/06/2023","27/06/2023","27/06/2023","?","Italian Ministry of Economy and Finance","A subpage of the website of the Italian Ministry of Economy and Finance (the welfare fund), is defaced to advertise a gambling site.","Defacement","Public admin and defence, social security","Cyber Crime","IT","Link"
"115","27/06/2023","-","-","BlackBasta","Giambelli","The BlackBasta ransomware gang claims responsibility for a cyber attack to Giambelli, an Italian Real Estate firm.","Malware","Real estate","Cyber Crime","IT","Link"
"116","28/06/2023","During June 2023","Since March 2023","8Base","35 Organizations worldwide","Researchers from VMware/Carbon Black discover a spike of activities by the 8Base ransomware gang.","Malware","Multiple Industries","Cyber Crime",">1","Link"
"117","28/06/2023","-","23/06/2023","Akira","VMware ESXi servers worldwide","The Akira ransomware operation releases a Linux encryptor to encrypt VMware ESXi virtual machines in double-extortion attacks against companies worldwide.","Malware","Multiple Industries","Cyber Crime",">1","Link"
"118","28/06/2023","'Recently'","'Recently'","Andariel (AKA Stonefly)","Unspecified organization(s)","Researchers from Kaspersky discover a previously undocumented remote access trojan (RAT) named 'EarlyRAT,' used by Andariel, a sub-group of the Lazarus North Korean state-sponsored hacking group.","Targeted Attack","Unknown","Cyber Espionage","N/A","Link"
"119","28/06/2023","28/06/2023","28/06/2023","Attackers allegedly affiliated with the Wagner Group","Dozor-Teleport","A group of previously unknown attackers allegedly affiliated with the Wagner Group claims responsibility for a cyberattack on the Russian satellite communications provider Dozor-Teleport and its parent company Amtel Svyaz.","DDoS","Information and communication","Hacktivism","RU","Link"
"120","28/06/2023","-","-","SiegedSec","Nebraska Supreme Court","Hacktivists from the SiegedSec collective dump some data from the Nebraska Supreme Court.","Unknown","Public admin and defence, social security","Hacktivism","US","Link"
"121","28/06/2023","-","-","SiegedSec","South Dakota Boards and Commissions (BAC)","Hacktivists from the SiegedSec collective dump some data from the South Dakota Boards and Commissions","Unknown","Public admin and defence, social security","Hacktivism","US","Link"
"122","28/06/2023","-","-","SiegedSec","Texas Behavioral Health Executive Council (BHEC)","Hacktivists from the SiegedSec collective dump some data from the South Dakota Boards and Commissions","Unknown","Public admin and defence, social security","Hacktivism","US","Link"
"123","28/06/2023","-","-","SiegedSec","Pennsylvania Provider Self-Service","Hacktivists from the SiegedSec collective dump some data from the Pennsylvania Provider Self-Service","Unknown","Public admin and defence, social security","Hacktivism","US","Link"
"124","28/06/2023","-","-","SiegedSec","South Carolina Criminal Justice Information Services (CJIS)","Hacktivists from the SiegedSec collective dump some data from the South Carolina Criminal Justice Information Services (CJIS)","Unknown","Public admin and defence, social security","Hacktivism","US","Link"
"125","28/06/2023","-","-","Clop AKA Lace Tempest, TA505 and, FIN11","Sony","Sony is listed by the Cl0p gang among the victims of a data breach occurred exploiting the MOVEit vulnerability.","CVE-2023-34362 Vulnerability","Manufacturing","Cyber Crime","JP","Link"
"126","28/06/2023","-","-","Clop AKA Lace Tempest, TA505 and, FIN11","Cognizant","Cognizant is listed by the Cl0p gang among the victims of a data breach occurred exploiting the MOVEit vulnerability.","CVE-2023-34362 Vulnerability","Professional, scientific and technical","Cyber Crime","US","Link"
"127","28/06/2023","-","-","Clop AKA Lace Tempest, TA505 and, FIN11","U.S. Department of Health and Human Services (HHS)","The U.S. Department of Health and Human Services (HHS) is listed by the Cl0p gang among the victims of a data breach occurred exploiting the MOVEit vulnerability.","CVE-2023-34362 Vulnerability","Professional, scientific and technical","Cyber Crime","US","Link"
"128","28/06/2023","21/06/2023","-","?","Radeal","Radeal, the Polish developer of the Android stalkerware ‘LetMeSpy’, informs users that their personal information and collected data was stolen as a result of a cyberattack.","Unknown","Professional, scientific and technical","Cyber Crime","PL","Link"
"129","28/06/2023","28/06/2023","28/06/2023","NoName057(16)","SJ AB","The pro-Russian hacktivists from the NoName057(16) collective take down the website of the Swedish railway carrier SJ AB","DDoS","Transportation and storage","Hacktivism","SE","Link"
"130","28/06/2023","28/06/2023","28/06/2023","NoName057(16)","Swedish Financial Supervisory Authority, Finansinspektionen (FI).","The pro-Russian hacktivists from the NoName057(16) collective take down the website of the Swedish Financial Supervisory Authority, Finansinspektionen (FI).","DDoS","Public admin and defence, social security","Hacktivism","SE","Link"
"131","28/06/2023","During May 2023","During May 2023","APT35 (aka Charming Kitten, Imperial Kitten, or Tortoiseshell)","Israeli Journalist","Researchers from Volexity discover a campaign by the Iranian threat actor Charming Kitten attempting to distribute the POWERSTAR backdoor via a spear-phishing campaign involving an LNK file inside a password-protected RAR file.","Targeted Attack","Information and communication","Cyber Espionage","IL","Link"
"132","28/06/2023","'Recently'","'Recently'","Triada","Android users","Researchers at Check Point uncover a trojanized version of the widely-used Telegram messenger, containing embedded malicious code associated with the Triada trojan.","Malware","Individual","Cyber Crime",">1","Link"
"133","28/06/2023","'Recently'","'Recently'","?","Wealth Enhancement Group (WEG)","Wealth Enhancement Group (WEG) files a notice of data breach after discovering that an unauthorized party was able to access a standalone server in one of the company’s advisor team offices.","Unknown","Finance and insurance","Cyber Crime","US","Link"
"134","28/06/2023","14/01/2023","14/01/2023","?","Citi Trends","Citi Trends files a notice of data breach after discovering that an unauthorized party was able to access confidential employee information stored on the company’s IT network.","Unknown","Wholesale and retail","Cyber Crime","US","Link"
"135","28/06/2023","01/05/2023","01/05/2023","?","Roosevelt University","Roosevelt University (RU) files a notice of data breach after discovering that an unauthorized actor was able to access confidential student and prospective student information in the school’s possession.","Unknown","Education","Cyber Crime","US","Link"
"136","29/06/2023","SInce at least 08/06/2023","08/06/2023","?","Multiple organizations","Researchers from Akamai discover a proxyjacking campaign targeting vulnerable SSH servers, then launching Docker services that share the victim's bandwidth for money.","Misconfiguration","Multiple Industries","Cyber Crime",">1","Link"
"137","29/06/2023","-","29/06/2023","?","Multiple organizations","Researchers from Wordfence disclose that attackers are exploiting CVE-2023-3460, a zero-day privilege escalation vulnerability in the 'Ultimate Member' WordPress plugin to compromise websites by bypassing security measures and registering rogue administrator accounts.","CVE-2023-3460 Vulnerability","Multiple Industries","Cyber Crime",">1","Link"
"138","29/06/2023","-","-","Clop AKA Lace Tempest, TA505 and, FIN11","Kirkland & Ellis","The law firms Kirkland & Ellis is listed by the Cl0p gang among the victims of a data breach occurred exploiting the MOVEit vulnerability.","CVE-2023-34362 Vulnerability","Professional, scientific and technical","Cyber Crime","US","Link"
"139","29/06/2023","-","-","Clop AKA Lace Tempest, TA505 and, FIN11","K&L Gates","The law firms K&L Gates is listed by the Cl0p gang among the victims of a data breach occurred exploiting the MOVEit vulnerability.","CVE-2023-34362 Vulnerability","Professional, scientific and technical","Cyber Crime","US","Link"
"140","29/06/2023","-","During May 2023","Turkey","Individuals in Turkey","Researchers from Google terminate 14 YouTube channels part of a coordinated influence operations linked to Turkey and sharing content in Turkish supportive of the AK Party.","Coordinated Inauthentic Behavior","Individual","Cyber Warfare","TR","Link"
"141","29/06/2023","-","During May 2023","Turkey","Individuals in Turkey","Researchers from Google terminate 68 YouTube channels part of a coordinated influence operations linked to Turkey and sharing content in Turkish supportive of the Nationalist Movement Party (MHP) and Victory Party.","Coordinated Inauthentic Behavior","Individual","Cyber Warfare","TR","Link"
"142","29/06/2023","-","During May 2023","Iran","Individuals","Researchers from Google terminate 14 YouTube channels part of a coordinated influence operations linked to Iran and sharing content about a variety of topics including content supportive of Palestine and critical of Israel.","Coordinated Inauthentic Behavior","Individual","Cyber Warfare","IL","Link"
"143","29/06/2023","-","During May 2023","Iran","Individuals","Researchers from Google terminate 3 YouTube channels part of a coordinated influence operations linked to Iran and sharing content in French and English related to Iranian hack-and-leak operations.","Coordinated Inauthentic Behavior","Individual","Cyber Warfare",">1","Link"
"144","29/06/2023","-","During May 2023","Russian consulting firm","Individuals","Researchers from Google terminate 337 YouTube channels part of a coordinated influence operations linked to a Russian consulting firm and sharing content in Russian supportive of Russia and Russian President Vladimir Putin and critical of Ukraine, NATO and the West.","Coordinated Inauthentic Behavior","Individual","Cyber Warfare","UA","Link"
"145","29/06/2023","-","During May 2023","Russia","Individuals","Researchers from Google terminate 7 YouTube channels part of a coordinated influence operations linked to Russia, and sharing content in Russian that promoted the Wagner Group and Yevgeny Prigozhin.","Coordinated Inauthentic Behavior","Individual","Cyber Warfare","RU","Link"
"146","29/06/2023","-","During May 2023","Spain","Individuals in Spain","Researchers from Google terminate 35 Youtube channels part of a coordinated influence operations linked to Spain, and sharing content in Spanish that was critical of the Spanish government.","Coordinated Inauthentic Behavior","Individual","Cyber Warfare","ES","Link"
"147","29/06/2023","-","During May 2023","Mexico","Individuals in Mexico","Researchers from Google terminate 188 YouTube channels part of a coordinated influence operations linked to Mexico, sharing content in Spanish supportive of the Morena party and Senator Ricardo Monreal.","Coordinated Inauthentic Behavior","Individual","Cyber Warfare","MX","Link"
"148","29/06/2023","-","During May 2023","China","Individuals Worldwide","Researchers from Google terminate 9,599 YouTube channels and 3 Blogger blogs part of a coordinated influence operations linked to China, uploading spammy content in Chinese about music, entertainment and lifestyle. A very small subset uploaded content in Chinese and English about China and U.S. foreign affairs.","Coordinated Inauthentic Behavior","Individual","Cyber Warfare",">1","Link"
"149","29/06/2023","-","-","Clop AKA Lace Tempest, TA505 and, FIN11","The Harrington Company","The Minnesota business firm The Harrington Company is added to the Clop ransomware leak site of the victims of the MOVEit breach.","CVE-2023-34362 Vulnerability","Administration and support service","Cyber Crime","US","Link"
"150","29/06/2023","-","-","Clop AKA Lace Tempest, TA505 and, FIN11","City National Bank","City National Bank in Miami, Florida is added to the Clop ransomware leak site of the victims of the MOVEit breach.","CVE-2023-34362 Vulnerability","Finance and insurance","Cyber Crime","US","Link"
"151","29/06/2023","-","-","BlueNoroff (part of the Lazarus Group)","Multiple organizations","Researchers from Elastic detect a new variant of the RUSTBUCKET malware with improved capabilities to establish persistence and avoid detection by security software.","Malware","Multiple Industries","Cyber Espionage",">1","Link"
"152","29/06/2023","Since April 2023","Since April 2023","?","Law firms, Healthcare and Investment Firms","Researchers from Morphisec Labs discover an active GuLoader campaign that primarily focuses on law firms, along with healthcare and investment firms, specifically within the United States","Malware","Multiple Industries","Cyber Crime","US","Link"
"153","29/06/2023","Earlier in 2023","Earlier in 2023","?","Undisclosed organization(s) in the UAE","The head of UAE Cyber Security reveals that, earlier in 2023, Israel aided the United Arab Emirates (UAE) in helping repel a major distributed denial-of-service (DDoS) attack.","DDoS","Unknown","N/A","UAE","Link"
"154","29/06/2023","27/05/2023","01/06/2023","Clop AKA Lace Tempest, TA505 and, FIN11","Bristol Myers Squibb","Bristol Myers Squibb files a notice regarding a data breach resulting from the CVE-2023-34362 vulnerability in MOVEit.","CVE-2023-34362 Vulnerability","Professional, scientific and technical","Cyber Crime","US","Link"
"155","29/06/2023","10/05/2023","'Recently'","?","Advanced Medical Management","Advanced Medical Management files a notice of data breach after discovering that portions of the company’s IT network that were designed and maintained by third-party vendors were accessible to an unauthorized party.","Unknown","Human health and social work","Cyber Crime","US","Link"
"156","29/06/2023","24/11/2021","-","?","CommerceV3","John & Kira’s and Smithfield Specialty Foods each file a notice of data breach after learning about an incident that occurred at CommerceV3, a company that provides various web-hosting services.","Unknown","Professional, scientific and technical","Cyber Crime","US","Link"
