"ID","Date Reported","Date Occurred","Date Discovered","Author","Target","Description","Attack","Target Class","Attack Class","Country","Link"
"1","16/06/2023","-","-","Clop AKA Lace Tempest, TA505 and, FIN11","U.S. Department of Agriculture","The U.S. Department of Agriculture confirms to have suffered a cyber attack exploiting the MOVEit CVE-2023-34362 vulnerability.","CVE-2023-34362 Vulnerability","Public admin and defence, social security","Cyber Crime","US","Link"
"2","16/06/2023","Since at least 18/04/2023","-","JokerSpy","Multiple organizations","Researchers from BitDefender discover a set of malicious components, believed to be a part of an advanced toolkit designed to compromise macOS systems.","Malware","Multiple Industries","Cyber Crime",">1","Link"
"3","16/06/2023","During mid-January 2023","During mid-January 2023","?","LetsVPN Users","Researchers from Cyble discover numerous counterfeit LetsVPN websites, deliberately designed to distribute malware, masquerading as the genuine LetsVPN application.","Malware","Individual","Cyber Crime",">1","Link"
"4","16/06/2023","-","-","Clop AKA Lace Tempest, TA505 and, FIN11","Honeywell International","Honeywell International posts a notice on its website describing a data breach resulting from the CVE-2023-34362 vulnerability in MOVEit.","CVE-2023-34362 Vulnerability","Professional, scientific and technical","Cyber Crime","US","Link"
"5","16/06/2023","-","-","Clop AKA Lace Tempest, TA505 and, FIN11","East Western Bank","East Western Bank joins the list of the victims of the data breach resulting from the CVE-2023-34362 vulnerability in MOVEit.","CVE-2023-34362 Vulnerability","Finance and insurance","Cyber Crime","US","Link"
"6","16/06/2023","-","-","Clop AKA Lace Tempest, TA505 and, FIN11","Nuance","Software firm Nuance joins the list of the victims of the data breach resulting from the CVE-2023-34362 vulnerability in MOVEit.","CVE-2023-34362 Vulnerability","Professional, scientific and technical","Cyber Crime","US","Link"
"7","16/06/2023","14/02/2023","14/03/2023","?","The Hatcher Agency","The Hatcher Agency files a notice of data breach after learning that a recent data security incident resulted in confidential consumer information being accessible to an unauthorized party.","Unknown","Administration and support service","Cyber Crime","US","Link"
"8","16/06/2023","-","-","?","Parker Wellbore","Parker Wellbore files a notice of data breach after learning that hackers gained access to confidential information that had been entrusted to the company.","Unknown","Administration and support service","Cyber Crime","US","Link"
"9","16/06/2023","12/02/2023","19/04/2023","?","New Horizons Medical","New Horizons Medical files a notice of data breach after learning that a recent data security incident compromised the personal information of 12,317 New Horizons patients.","Unknown","Human health and social work","Cyber Crime","US","Link"
"10","16/06/2023","During January 2023","During January 2023","TimisoaraHackerTeam","Undisclosed U.S. cancer center","The Health Sector Cybersecurity Coordination Center issues an alert regarding a new relatively unknown ransomware group named TimisoaraHackerTeam that recently targeted an undisclosed U.S. cancer center.","Malware","Human health and social work","Cyber Crime","US","Link"
"11","16/06/2023","End of May 2023","End of May 2023","LockBit","Granules India","The Russia-linked ransomware group LockBit claims responsibility for a cyberattack on Indian pharmaceutical giant Granules India, and publishes portions of the data it allegedly stole.","Malware","Professional, scientific and technical","Cyber Crime","IN","Link"
"12","16/06/2023","10/06/2023","10/06/2023","?","Smartpay","Eftpos provider Smartpay reveals that criminals stole customer data in a ransomware attack.","Malware","Professional, scientific and technical","Cyber Crime","NZ","Link"
"13","16/06/2023","-","-","?","MyShopCasa","MyShopCasa, an Italian e-commerce site has its database leaked.","Unknown","Wholesale and retail","Cyber Crime","IT","Link"
"14","16/06/2023","-","-","8Base","Studio Legale Ranchino","The Studio Legale Ranchino, an Italian law firm suffers a ransomware attack by the 8Base gang.","Malware","Professional, scientific and technical","Cyber Crime","IT","Link"
"15","17/06/2023","-","-","Clop AKA Lace Tempest, TA505 and, FIN11","U.S. Office of Personnel Management","The U.S. Office of Personnel Management confirms to have suffered a cyber attack exploiting the MOVEit CVE-2023-34362 vulnerability.","CVE-2023-34362 Vulnerability","Public admin and defence, social security","Cyber Crime","US","Link"
"16","18/06/2023","-","-","Clop AKA Lace Tempest, TA505 and, FIN11","Undisclosed Property Manager","Australia's largest private health insurer Medibank Private discloses that a file containing names and contact details of staff members had been compromised after its property manager faced a cybersecurity breach due to the exploitation of the MOVEit CVE-2023-34362 vulnerability.","CVE-2023-34362 Vulnerability","Real estate","Cyber Crime","AU","Link"
"17","18/06/2023","18/06/2023","18/06/2023","Turk Hack Team","Central Bank of Malta","The collective Turk Hack Team takes down the website of the Central Bank of Malta","DDoS","Finance and insurance","Hacktivism","ML","Link"
"18","19/06/2023","'Recently'","'Recently'","APT-C-35 AKA DoNot","Individuals in Pakistan","Researchers from Cyfirma discover three Android apps on Google Play (Device Basic Plus, nSure Chat, and iKHfaa VPN) used by the state-sponsored threat actors to collect intelligence from targeted devices, such as location data and contact lists.","Targeted Attack","Individual","Cyber Espionage","PK","Link"
"19","19/06/2023","19/06/2023","19/06/2023","Killnet","European Investment Bank (EIB)","The pro-Russian Killnet hacktivist group claims to have taken down the network infrastructure of the European Investment Bank - EIB.","DDoS","Extraterritorial orgs and bodies","Hacktivism","EU","Link"
"20","19/06/2023","-","19/06/2023","?","BreachForums","The reincarnated BreachForums site just has its user database stolen and published.","Unknown","Other service activities","Cyber Crime","N/A","Link"
"21","19/06/2023","-","-","Clop AKA Lace Tempest, TA505 and, FIN11","Umpqua Bank","Umpqua Bank confirms that it was impacted by the massive cyberattack targeting the MOVEit file transfer software.","CVE-2023-34362 Vulnerability","Finance and insurance","Cyber Crime","US","Link"
"22","19/06/2023","During January 2023","-","Clop AKA Lace Tempest, TA505 and, FIN11","Blue Cross Vermont","Approximately 16,000 members of Blue Cross Vermont health plans have their protected health information compromised in a January 2023 cyberattack carried out exploiting the CVE-2023-0669 zero-day vulnerability in Fortra’s GoAnywhere MFT file transfer solution and accessed and stole sensitive data such as names, birth dates, addresses, medical information, and insurance information. Around 5% of the affected individuals also had their financial information stolen.","CVE-2023-0669 Fortra GoAnywhere MFT Vulnerability","Human health and social work","Cyber Crime","US","Link"
"23","19/06/2023","-","-","Clop AKA Lace Tempest, TA505 and, FIN11","Informatica","Software development firm Informatica reports that the Clop ransomware gang campaign obtained some files exploiting the MOVEit CVE-2023-34362 Vulnerability.","CVE-2023-34362 Vulnerability","Professional, scientific and technical","Cyber Crime","US","Link"
"24","20/06/2023","Since November 2021","-","APT28 (AKA BlueDelta, Fancy Bear, Sednit, Forest Blizzard and Sofacy)","Organizations in Ukraine","A joint investigation conducted by Ukraine's Computer Emergency Response Team (CERT-UA) and Recorded Future reveal that the APT28 group, linked to Russia's General Staff Main Intelligence Directorate (GRU), has breached Roundcube email servers belonging to multiple Ukrainian organizations, including government entities, exploiting the vulnerabilities CVE-2020-35730, CVE-2020-12641, and CVE-2021-44026.","Targeted Attack","Public admin and defence, social security","Cyber Espionage","UA","Link"
"25","20/06/2023","Over the past year","-","?","Multiple organizations","Researchers from Group-IB discover more than 101,000 ChatGPT user accounts stolen by information-stealing malware on various underground websites.","Malware","Multiple Industries","Cyber Crime",">1","Link"
"26","20/06/2023","Since at least 2020","'Recently'","State-sponsored APT aligned with China","Organizations in East Asia","Researchers at Bitdefender reveal the details of Operation RedClouds, a campaign carried out by an advanced threat actor aligned with China, using a custom malware dubbed 'RDStealer' to automatically steal data from drives shared through Remote Desktop connections.","Targeted Attack","Multiple Industries","Cyber Espionage",">1","Link"
"27","20/06/2023","'Recently'","'Recently'","?","Multiple organizations","Researchers from AhnLab reveal that an unknown threat actor is brute-forcing Linux SSH servers to install a wide range of malware, including the Tsunami DDoS bot, ShellBot, log cleaners, privilege escalation tools, and an XMRig coin miner.","Misconfiguration","Multiple Industries","Cyber Crime",">1","Link"
"28","20/06/2023","Since at least 15/06/2023","15/06/2023","Multiple threat actors","Multiple organizations","VMware warns that the CVE-2023-20887 vulnerability, allowing remote code execution, is being actively exploited in attacks.","CVE-2023-20887 Vulnerability","Multiple Industries","N/A",">1","Link"
"29","20/06/2023","Since May 2023","During May 2023","Condi","Vulnerable TP-Link routers","Researchers from Fortinet warn that a new DDoS-as-a-Service botnet called ""Condi"" is exploiting a vulnerability in TP-Link Archer AX21 (AX1800) Wi-Fi routers to build an army of bots to conduct attacks.","CVE-2023-1389 Vulnerability","Multiple Industries","Cyber Crime",">1","Link"
"30","20/06/2023","12/04/2023","16/06/2023","?","iOttie","Car mount and mobile accessory maker iOttie warns that its site was compromised for almost two months to steal online shoppers' credit cards and personal information.","Malicious Script Injection","Manufacturing","Cyber Crime","US","Link"
"31","20/06/2023","-","13/06/2023","?","Hawaiʻi Community College","Hawaiʻi Community College discloses to be dealing with a ransomware attack.","Malware","Education","Cyber Crime","US","Link"
"32","20/06/2023","29/04/2023","-","?","Vincera Institute","Vincera Institute, a leading healthcare facility in Philadelphia, issues a notice regarding a recent ransomware attack","Malware","Human health and social work","Cyber Crime","US","Link"
"33","20/06/2023","-","-","?","Community Research Foundation","Community Research Foundation (CRF) files a notice of data breach, noting that a “Hacking/IT Incident” resulted in the confidential information of 30,057 individuals being leaked.","Unknown","Human health and social work","Cyber Crime","US","Link"
"34","20/06/2023","-","13/03/2023","?","Kannact","Kannact files a notice of data breach after determining that a recent data security incident resulted in unauthorized access to confidential consumer information that was in the company’s possession.","Unknown","Professional, scientific and technical","Cyber Crime","US","Link"
"35","20/06/2023","Around 10/06/2023","-","?","Stephen F. Austin State University","Stephen F. Austin State University is hit with a cyberattack.","Unknown","Education","Cyber Crime","US","Link"
"36","20/06/2023","-","19/06/2023","-","Radà","A database with 25,000 records of the Italian jewelry firm Radà, is published on Breach Forums.","Unknown","Manufacturing","Cyber Crime","IT","Link"
"37","20/06/2023","-","-","?","City of San Luis","The City of San Luis discloses an unauthorized access to an employee’s email account that contained the protected health information of 6,848 individuals","Account Takeover","Public admin and defence, social security","Cyber Crime","US","Link"
"38","21/06/2023","Between late 2022 and early 2023","-","APT15 AKA Nickel, Flea, Ke3Chang, and Vixen Panda","Foreign affairs ministries in Central and South American countries","Researchers from Broadcom/Symantec unearth a new campaign by the Chinese state-sponsored group tracked as APT15, using a novel backdoor named 'Graphican'.","Targeted Attack","Public admin and defence, social security","Cyber Espionage",">1","Link"
"39","21/06/2023","Since at least February 2023","-","?","UPS Customers in Canada","Multinational shipping company UPS alerts Canadian customers that some of their personal information might have been exposed via its online package look-up tools and abused in phishing attacks.","Account Takeover","Administration and support service","Cyber Crime","CA","Link"
"40","21/06/2023","During May 2023","During May 2023","APT37 (AKA StarCruft, Reaper, or RedEyes)","Multiple organizations","Researchers from AhnLab reveal the details of the latest campaign from the North Korean threat actor APT37 using two new custom malware strains dubbed 'AblyGo backdoor' and 'FadeStealer'.","Targeted Attack","Multiple Industries","Cyber Espionage","N/A","Link"
"41","21/06/2023","06/06/2023","06/06/2023","Russia","Individuals Worldwide","Russian officials and diplomats have been coordinating an unusually organized and large-scale disinformation campaign to discredit reports that the nation is responsible for the June 6 collapse of the Nova Kakhovka Dam.","Coordinated Inauthentic Behavior","Individual","Cyber Warfare",">1","Link"
"42","21/06/2023","-","-","Clop AKA Lace Tempest, TA505 and, FIN11","Gen","Cybersecurity giant Gen, which owns well-known brands like Norton, Avast, LifeLock, Avira, AVG, ReputationDefender and CCleaner, confirms that its data was accessed through a cyber attack exploiting the MOVEit CVE-2023-34362 vulnerability.","CVE-2023-34362 Vulnerability","Professional, scientific and technical","Cyber Crime","US","Link"
"43","21/06/2023","-","-","Clop AKA Lace Tempest, TA505 and, FIN11","Metro Vancouver Transit Police","The Metro Vancouver Transit Police confirms to have suffered a cyber attack exploiting the MOVEit CVE-2023-34362 vulnerability.","CVE-2023-34362 Vulnerability","Public admin and defence, social security","Cyber Crime","CA","Link"
"44","21/06/2023","-","-","Clop AKA Lace Tempest, TA505 and, FIN11","University of Missouri","The University of Missouri confirms to have suffered a cyber attack exploiting the MOVEit CVE-2023-34362 vulnerability.","CVE-2023-34362 Vulnerability","Education","Cyber Crime","US","Link"
"45","21/06/2023","-","-","Clop AKA Lace Tempest, TA505 and, FIN11","Telos","Telos, a US defense contractor specializing in cybersecurity, says that attackers downloaded its client data by exploiting the MOVEit transfer vulnerability.","CVE-2023-34362 Vulnerability","Professional, scientific and technical","Cyber Crime","US","Link"
"46","21/06/2023","-","-","APT29 AKA Cozy Bear, Nobelium, Midnight Blizzard","Governments, IT service providers, nongovernmental organizations (NGOs), and defense and critical manufacturing industries.","Researchers from Microsoft detect increased credential attack activity by the threat actor APT29 (Midnight Blizzard) using residential proxy services to obfuscate the source of their attacks.","Password-spray","Multiple Industries","Cyber Espionage",">1","Link"
"47","21/06/2023","-","-","ALPHV AKA BlackCat","Beverly Hills Plastic Surgery (BHPS)","The ALPHV/BlackCat ransomware gang claims responsibility for the attack to Beverly Hills Plastic Surgery (BHPS).","Malware","Human health and social work","Cyber Crime","US","Link"
"48","21/06/2023","'Recently'","'Recently'","RedEnergy","Multiple organizations","Researchers from Zscaler discover a new malware variant, RedEnergy stealer that fits into the hybrid Stealer-as-a-Ransomware threat category.","Malware","Multiple Industries","Cyber Crime",">1","Link"
"49","21/06/2023","-","-","Cyber Criminals in Ukraine","Online wallets of Canadian citizens","Ukrainian cyber police disrupt a fake investment scam that involved stealing cryptocurrency from the online wallets of several Canadian citizens.","Scam","Individual","Cyber Crime","CA","Link"
"50","21/06/2023","During Late May 2023","During Late May 2023","REF9134","Unknown cryptocurrency exchange located in Japan","Researchers from Elastic reveal that an unknown cryptocurrency exchange located in Japan was the target of an attack to deploy the Apple macOS backdoor called JokerSpy.","Malware","Fintech","Cyber Crime","JP","Link"
"51","21/06/2023","-","-","labs666","Maxar Technologies","A threat actor with the moniker labs666 active on a Russian-language hacker forum posts an advertisement offering access for sale to a military satellite operated by Maxar Technologies.","Unknown","Professional, scientific and technical","Cyber Crime","US","Link"
"52","21/06/2023","-","-","labs666","AT&T Corporation","The same threat actor is also offering email account access to AT&T Corporation.","Unknown","Information and communication","Cyber Crime","US","Link"
"53","21/06/2023","'Recently'","'Recently'","MULTI#STORM","Organizations in India and the U.S","Researchers from Securonix discover a new phishing campaign codenamed MULTI#STORM targeting organizations in India and the U.S. by leveraging JavaScript files to deliver remote access trojans on compromised systems.","Malware","Multiple Industries","Cyber Crime","IN US","Link"
"54","21/06/2023","From mid-2022 and early 2023","-","Mudded Libra","Multiple organizations","Researchers from Palo Alto Networks disclose the details of Muddled Libra, a threat group targeting large outsourcing firms with multi-layered, persistent attacks that start with smishing and end with data theft.","Account Takeover","Professional, scientific and technical","Cyber Crime",">1","Link"
"55","21/06/2023","-","-","?","Forevermoto","Forevermoto, an Italian e-commerce site dedicated to motorbikes has its database leaked online.","Unknown","Wholesale and retail","Cyber Crime","IT","Link"
"56","22/06/2023","-","-","?","Internet-exposed Linux and Internet of Things (IoT) devices","Researchers from Microsoft discover a cryptojacking campaign brute-forcing Internet-exposed Linux and Internet of Things (IoT) devices, and using a trojanized OpenSSH version.","Brute-force","Multiple Industries","Cyber Crime",">1","Link"
"57","22/06/2023","SInce at least 14/03/2023","14/03/2023","?","Vulnerable IoT devices","Researchers from Palo Alto Networks discover a variant of the Mirai botnet targeting almost two dozen vulnerabilities aiming to take control of D-Link, Arris, Zyxel, TP-Link, Tenda, Netgear, and MediaTek devices to use them for distributed denial-of-service (DDoS) attacks.","CVE-2019-12725, CVE-2019-17621, CVE-2019-20500, CVE-2021-25296, CVE-2021-46422, CVE-2022-27002, CVE-2022-29303, CVE-2022-30023, CVE-2022-30525, CVE-2022-31499, CVE-2022-36266, CVE-2022-40005, CVE-2022-45699, CVE-2023-1389, CVE-2023-25280, CVE-2023-27240 Vulnerabilities","Multiple Industries","Cyber Crime",">1","Link"
"58","22/06/2023","-","-","PindOS","Multiple organizations","Security researchers from Deep Instinct discover a new malicious Javascript dropper named PindOS that delivers the Bumblebee and IcedID malware typically associated with ransomware attacks.","Malware","Multiple Industries","Cyber Crime",">1","Link"
"59","22/06/2023","-","-","Clop AKA Lace Tempest, TA505 and, FIN11","PricewaterhouseCoopers (PWC)","PricewaterhouseCoopers (PWC) discloses that a small number of clients had some files impacted in a cyber incident involving the MOVEit vulnerability","CVE-2023-34362 Vulnerability","Professional, scientific and technical","Cyber Crime","US","Link"
"60","22/06/2023","-","-","Clop AKA Lace Tempest, TA505 and, FIN11","Ernst & Young (EY)","EY also confirms a MOVEit-related breach.","CVE-2023-34362 Vulnerability","Professional, scientific and technical","Cyber Crime","US","Link"
"61","22/06/2023","Early 2023","Early 2023","Camaro Dragon (AKA Mustang Panda and LuminousMoth)","European healthcare institution","Researchers from Check Point disclose the details of a cyber incident involving a hospital that was inadvertently affected by a self-propagating malware infection introduced to the healthcare institution’s network via a USB drive.","Malware","Human health and social work","Cyber Espionage","N/A","Link"
"62","22/06/2023","'Recently'","'Recently'","?","U.S healthcare and public health sector","The Health Sector Cybersecurity Coordination Center  warns that SEO poisoning attacks have been used ""recently and frequently"" against the U.S healthcare and public health sector.","Malware","Human health and social work","Cyber Crime","US","Link"
"63","22/06/2023","'Recently'","'Recently'","Volt Typhoon AKA Vanguard Panda","Undisclosed organization(S)","Researchers from Crowdstrike detect a new campaign by the Chinese state-backed APT Volt Typhoon AKA Vanguard Panda exploiting CVE-2021-40539, a two-year old critical vulnerability in Zoho's ManageEngine ADSelfService Plus.","Targeted Attack","Unknown","Cyber Espionage",">1","Link"
"64","22/06/2023","'Recently'","'Recently'","Clop AKA Lace Tempest, TA505 and, FIN11","Vitality Group International","Vitality Group International files a notice of data breach after discovering that a vulnerability in a file transfer software used by the company allowed attackers to access certain confidential consumer information. The breach is believed to be related to the MOVEit CVE-2023-34362 Vulnerability.","CVE-2023-34362 Vulnerability","Professional, scientific and technical","Cyber Crime","US","Link"
"65","22/06/2023","23/04/2023","23/04/2023","?","Desert Physicians Management","Desert Physicians Management (DPM) files a notice of data breach after determining that a recent cybersecurity incident compromised confidential patient information.","Unknown","Human health and social work","Cyber Crime","US","Link"
"66","22/06/2023","23/03/2023","23/03/2023","?","Atlanta Postal Credit Union","Atlanta Postal Credit Union (APCU) files a notice of data breach after learning that a recent ransomware attack compromised the confidential information of some bank customers.","Malware","Finance and insurance","Cyber Crime","US","Link"
"67","22/06/2023","12/06/2023","12/06/2023","?","San Luis Obispo County Office of Education","San Luis Obispo County Office of Education suffers a cyber attack.","Unknown","Public admin and defence, social security","Cyber Crime","US","Link"
"68","22/06/2023","19/04/2023","23/04/2023","?","Limbach Facility Services","Limbach Facility Services confirms to have fallen victim to a cyberattack that affected the availability and functionality of its computer network.","Unknown","Professional, scientific and technical","Cyber Crime","US","Link"
"69","23/06/2023","27/05/2023","-","Clop AKA Lace Tempest, TA505 and, FIN11","PBI Research Services (PBI)","PBI Research Services (PBI) suffers a data breach with three clients (Genworth Financial, Wilton Reassurance, and CalPERS - California Public Employees' Retirement System) disclosing that the data for 4.75 million people was stolen in the recent MOVEit Transfer data-theft attacks.","CVE-2023-34362 Vulnerability","Administration and support service","Cyber Crime","US","Link"
"70","23/06/2023","30/04/2023","03/05/2023","?","Pilot Credentials","American Airlines and Southwest Airlines, two of the largest airlines in the world, disclose data breaches caused by the hack of Pilot Credentials, a third-party vendor that manages multiple airlines' pilot applications and recruitment portals.","Unknown","Administration and support service","Cyber Crime","US","Link"
"71","23/06/2023","'Recently'","'Recently'","?","Players of Super Mario 3: Mario Forever","Researchers from Cyble discover that threat actors are distributing a trojanized sample of the Super Mario 3: Mario Forever installer, distributing the SupremeBot malware.","Malware","Arts entertainment, recreation","Cyber Crime",">1","Link"
"72","23/06/2023","During June 2023","During June 2023","?","Taylor Swift fans","The Better Business Bureau (BBB) warns of scams involving fake Taylor Swift concert tickets.","Scam","Arts entertainment, recreation","Cyber Crime",">1","Link"
"73","23/06/2023","Since at least 11/06/2023","11/06/2023","?","Multiple organizations","Researchers from Phylum discover a new ongoing campaign aimed at the npm ecosystem that leverages a unique execution chain to deliver an unknown payload to targeted systems.","Malware","Multiple Industries","Cyber Crime",">1","Link"
"74","23/06/2023","Between 18/04/2023 and 24/04/2023","24/04/2023","?","Senior Choice","Senior Choice, doing business as The Atrium,  Beacon Ridge, and The Patriot reports a cyber incident.","Unknown","Human health and social work","Cyber Crime","US","Link"
"75","23/06/2023","Between 18/04/2023 and 24/04/2023","24/04/2023","?","Williamsport Home","Williamsport Home confirms that it experienced a data incident,","Unknown","Human health and social work","Cyber Crime","US","Link"
"76","23/06/2023","-","-","Individuals in Ukraine","Azerbaijani citizens","The cyber police of Ukraine, in coordination with the national police, busts four call centers in the Kyiv and Lyiv regions that had been running investment scams targeting Azerbaijani citizens.","Scam","Individual","Cyber Crime","AZ","Link"
"77","23/06/2023","22/04/2023","27/04/2023","?","Activate Healthcare","Activate Healthcare files a notice of data breach after learning that an unauthorized party was able to access confidential patient information following what appears to have been a cyberattack.","Unknown","Human health and social work","Cyber Crime","US","Link"
