"ID","Date Reported","Date Occurred","Date Discovered","Author","Target","Description","Attack","Target Class","Attack Class","Country","Link"
"1","16/04/2024","Since December 2023","Since December 2024","TA427, a.k.a. Emerald Sleet, APT43, THALLIUM or Kimsuky.","Foreign policy experts for insight into US and the Republic of Korea","Researchers from Proofpoint reveal the details of a campaign orchestrated by threat actors aligned with North Korea and targeting foreign policy experts for insight into US and the Republic of Korea.","Targeted Attack","Individual","Cyber Espionage",">1","Link"
"2","16/04/2024","Since early March 2024","Since early March 2024","Multiple threat actors","Multiple organizations","Researchers from Fortinet observe multiple botnets exploiting CVE-2023-1389, a vulnerability targeting TP-Link Archer AX21 (AX1800) routers.","CVE-2023-1389 Vulnerability","Multiple Industries","Cyber Crime",">1","Link"
"3","16/04/2024","Since February 2022","Since February 2022","Russia","Czech national railway operator České dráhy","Czech transport minister Martin Kupka warn that Russia conducted ‘thousands’ of attempts to sabotage railways, attempting to interfere with train networks and signals.","Unknown","Transportation and storage","Cyber Warfare","CZ","Link"
"4","16/04/2024","Since at least 18/03/2024","16/04/2024","?","Multiple organizations","Researchers from Cisco Talos warn about a global surge in brute-force attacks targeting various devices, including Virtual Private Network (VPN) services, web application authentication interfaces, and SSH services.","Brute-force","Multiple Industries","Cyber Crime",">1","Link"
"5","16/04/2024","-","-","UAC-0184","Ukrainian armed forces","The Computer Emergency Team of Ukraine (CERT-UA) warns that threat actors from the group UAC-0184 are increasingly trying to plant data-stealing malware on messaging apps used by the Ukrainian armed forces.","Targeted Attack","Public admin and defence, social security","Cyber Espionage","UA","Link"
"6","16/04/2024","-","-","L00KUPRU","Multiple organizations","Researchers from Broadcom discover L00KUPRU, a new variant of the Xorist ransomware, encrypting user files with the .L00KUPRU extension.","Ransomware","Multiple Industries","Cyber Crime",">1","Link"
"7","16/04/2024","-","27/03/2024","8Base","United Nations Development Programme","​The United Nations Development Programme (UNDP) investigates a cyberattack after threat actors breached its IT systems to steal human resources data. The 8Base ransomware operation claims responsibility for the attack.","Ransomware","Extraterritorial orgs and bodies","Cyber Crime","INT","Link"
"8","16/04/2024","-","-","?","Argentina's driver licenses","A threat actor allegedly hacks a database holding 5.7M Argentina’s driver’s licenses, requesting a payment of $3,000 USD for whoever wishes to purchase the images of Argentine licenses.","Unknown","Unknown","Cyber Crime","AR","Link"
"9","16/04/2024","Between 2017 and 2022","Between 2017 and 2022","?","Individuals in Poland","Poland’s national prosecutor Adam Bodnar declares that nearly 578 citizens were targeted with powerful commercial spyware Pegasus between 2017 and 2022.","Targeted Attack","Individual","Cyber Espionage","PL","Link"
"10","16/04/2024","-","15/04/2024","8Base","Atlantic States Marine Fisheries Commission","The Atlantic States Marine Fisheries Commission (ASMFC) suffers an 8Base ransomware attack.","Ransomware","Administration and support service","Cyber Crime","US","Link"
"11","16/04/2024","21/12/2023","24/12/2023","?","Cherry Health Services","Cherry Health discloses a ransomware attack.","Ransomware","Human health and social work","Cyber Crime","US","Link"
"12","16/04/2024","12/04/2024","-","?","Bağcılar Training and Research Hospital","A cyber attack on the Bağcılar Training and Research Hospital in Istanbul compromises the confidential medical records, including X-ray scans and test results, taken at the hospital since 2007. It is rumored that the attackers asked for 200,000 dollars in exchange for the medical records.","Ransomware","Human health and social work","Cyber Crime","TR","Link"
"13","16/04/2024","06/06/2023","09/04/2024","BlackByte","Kisco Senior Living","Kisco Senior Living discloses a BlackByte ransomware attack.","Ransomware","Human health and social work","Cyber Crime","US","Link"
"14","16/04/2024","-","15/04/2024","IntelBroker","Space-Eyes","“IntelBroker” claims to have breached Space-Eyes, a Miami-based geospatial intelligence firm.","Unknown","Professional, scientific and technical","Cyber Crime","US","Link"
"15","17/04/2024","-","-","Cerber (a.k.a C3RB3R)","Multiple organizations","Researchers from Cado Security reveal that threat actors are exploiting unpatched Atlassian servers to the  CVE-2023-22518 vulnerability to deploy a Linux variant of Cerber (aka C3RB3R) ransomware.","CVE-2023-22518 Vulnerability","Multiple Industries","Cyber Crime",">1","Link"
"16","17/04/2024","Since at least mid-2022","Since at least mid-2022","Sandworm (a.k.a. BlackEnergy, Seashell Blizzard, Voodoo Bear, APT44)","Organizations across Ukraine, and Central and Eastern Europe","Researchers from WithSecure uncover Kapeka, a novel backdoor that has been used in attacks against victims in Eastern Europe since at least mid-2022.","Targeted Attack","Multiple Industries","Cyber Espionage","UA >1","Link"
"17","17/04/2024","Since the beginning of April 2024","Since the beginning of April 2024","Chinese threat actors","Multiple organizations","Researchers from Microsoft warn that threat actors who appear to be Chinese are exploiting vulnerabilities in the OpenMetadata platform running as workloads on Kubernetes clusters to download cryptomining software onto the targeted systems.","CVE-2024-28255, CVE-2024-28847, CVE-2024-28253, CVE-2024-28848, CVE-2024-28254 Vulnerabilities","Multiple Industries","Cyber Crime",">1","Link"
"18","17/04/2024","Since March 2024","Since March 2024","?","Multiple organizations","Researchers from Zscaler observe a threat actor weaponizing a cluster of domains masquerading as legitimate IP scanner software sites to distribute ""MadMxShell"", a previously unseen backdoor.","Malvertising","Multiple Industries","Cyber Crime",">1","Link"
"19","17/04/2024","During late 2023","During late 2023","FIN7","Large U.S. car maker","Researchers from Blackberry reveal that the financially motivated threat actor FIN7 targeted a large U.S. car maker with spear-phishing emails for employees in the IT department to infect systems with the Anunak backdoor.","Malware","Manufacturing","Cyber Crime","US","Link"
"20","17/04/2024","'Recently'","'Recently'","?","Banking users in South Korea","Researchers from Kaspersky discover SoumniBot, a new banking trojan targeting Korean users using obfuscation techniques targeting the Android operating system.","Malware","Finance and insurance","Cyber Crime","KR","Link"
"21","17/04/2024","'Recently'","'Recently'","?","LastPass users","LastPass warns of a malicious campaign targeting its users with the CryptoChameleon phishing kit.","Account Takeover","Multiple Industries","Cyber Crime",">1","Link"
"22","17/04/2024","Since at least 2015","'Recently'","?","Government networks in Ukraine","Researchers from Cisco Talos reveal that select Ukrainian government networks have been infected with a malware called OfflRouter since 2015.","Targeted Attack","Public admin and defence, social security","N/A","UA","Link"
"23","17/04/2024","-","-","?","Individuals in multiple countries","Researchers from McAfee discover a new info-stealing malware linked to Redline posing as a game cheat called 'Cheat Lab,' promising downloaders a free copy if they convince their friends to install it too.","Malware","Individual","Cyber Crime",">1","Link"
"24","17/04/2024","16/04/2024","16/04/2024","LockBit","Hospital Simone Veil in Cannes","The Hospital Simone Veil in Cannes (CHC-SV) announces that it was targeted by a cyberattack, severely impacting its operations and forcing staff to go back to pen and paper. The LockBit ransomware operation claims responsibility for the attack.","Ransomware","Human health and social work","Cyber Crime","FR","Link"
"25","17/04/2024","Since early April 2024","Since early April 2024","Israel?","Ogero","Lebanon's state internet provider Ogero comes under a 10-day cyber attack of suspected Israeli origin.","Unknown","Information and communication","Cyber Warfare","LB","Link"
"26","17/04/2024","'Over the last 45 days'","'Over the last 45 days'","Russia","United States","Researchers from Microsoft reveal that Russia’s disinformation operations around the U.S. elections have ramped up over the last month-and-a-half after a relatively slow start compared to previous cycles.","Coordinated Inauthentic Behavior","Individual","Cyber Warfare","US","Link"
"27","17/04/2024","During January 2024","During January 2024","CyberArmyofRussia_Reborn","Muleshoe water facility","CyberArmyofRussia_Reborn, a group with ties to the Russian government is suspected of carrying out a cyberattack in the Muleshoe water facility that caused a tank at a Texas water facility to overflow.","Unknown","Water supply, waste mgmt, remediation","Cyber Warfare","US","Link"
"28","17/04/2024","-","-","Threat actor with possible ties to Russia","Hale Center water facility","Threat actors try to unsuccessfully break into the town of Hale Center “firewall,” prompting the town to disable remote access to its SCADA system.","Unknown","Water supply, waste mgmt, remediation","Cyber Warfare","US","Link"
"29","17/04/2024","-","-","Threat actor with possible ties to Russia","Lockney water facility","Town officials in Lockney detect “suspicious activity” on the town’s SCADA system.","Unknown","Water supply, waste mgmt, remediation","Cyber Warfare","US","Link"
"30","17/04/2024","-","-","?","Extern","Extern, a social justice charity, is hit with a ransomware attack.","Ransomware","Human health and social work","Cyber Crime","IE","Link"
"31","17/04/2024","-","15/04/2024","BlackSuit","The Post and Courier","The Post and Courier is hit with a BlackSuit ransomware attack.","Ransomware","Information and communication","Cyber Crime","US","Link"
"32","17/04/2024","17/04/2024","17/04/2024","?","New York Bill Drafting Commission","The New York Bill Drafting Commission is taken down by a malware attack.","Malware","Public admin and defence, social security","Cyber Crime","US","Link"
"33","18/04/2024","18/04/2024","18/04/2024","?","Crypto users","A legitimate-looking Google Search advertisement for the crypto trading platform 'Whales Market' redirects visitors to a wallet-draining phishing site that steals all the crypto assets.","Account Takeover","Fintech","Cyber Crime",">1","Link"
"34","18/04/2024","During February 2024","During February 2024","?","Government entities in the Middle East","Researchers from Kaspersky reveal the details of DuneQuixote, a previously undocumented campaign delivering a new backdoor dubbed CR4T.","Targeted Attack","Public admin and defence, social security","Cyber Espionage",">1","Link"
"35","18/04/2024","Since at least mid-March 2023","Mid-March 2023","?","Multiple organizations","Researchers from Perception Point discover a phishing campaign targeting users by exploiting an open redirect vulnerability from a domain belonging to coffee connoisseur, Nespresso.","Account Takeover","Multiple Industries","Cyber Crime",">1","Link"
"36","18/04/2024","During Summer of 2023","During Summer of 2023","Lazarus","Individuals in the Asian region","Researchers from Avast uncover a new campaign by the North Korea-linked threat actor known as Lazarus Group employing fabricated job lures to deliver a new remote access trojan called Kaolin RAT, exploiting CVE-2024-21338, as part of attacks targeting specific individuals in the Asia region.","Targeted Attack","Multiple Industries","Cyber Espionage",">1","Link"
"37","18/04/2024","14/04/2024","14/04/2024","RansomHub","Frontier Communications","​American telecom provider Frontier Communications is hit by a cyberattack claimed by the RansomHub ransomware operation.","Ransomware","Information and communication","Cyber Crime","US","Link"
"38","18/04/2024","During March 2024","18/04/2024","GhostR","Undisclosed Singapore-based firm","GhostR, a financially motivated criminal group says it has stolen a confidential database containing 5.3 million of records that companies use for screening potential customers for links to sanctions and financial crime from World-Check.","Unknown","Unknown","Cyber Crime","SG","Link"
"39","18/04/2024","-","13/04/2024","LockBit","Tyler Technologies?","The LockBit ransomware operation claims to have stolen data from the D.C. Department of Insurance, Securities and Banking (DISB), however the agencies denies the claims, and states that the leaked data is from a third-party technology provider.","Ransomware","Professional, scientific and technical","Cyber Crime","US","Link"
"40","18/04/2024","10/11/2023","11/03/2024","Hunters International","Blackstone Valley Community Health Care","Blackstone Valley Community Health Care discloses a Hunters International ransomware attack.","Ransomware","Human health and social work","Cyber Crime","US","Link"
"41","19/04/2024","During January 2024","-","state-backed threat actors","Mitre Corporation","The MITRE Corporation says that a state-backed threat actors breached its systems (MITRE's Networked Experimentation, Research, and Virtualization Environment - NERVE) in January 2024 by chaining the two Ivanti VPN zero-days CVE-2023-46805 and CVE-2024-21887.","CVE-2023-46805 and CVE-2024-21887 Vulnerabilities","Professional, scientific and technical","Cyber Espionage","US","Link"
"42","19/04/2024","-","-","?","Unknown organization(s)","CrushFTP warns customers in a private memo of CVE-2024-4040, an actively exploited zero-day vulnerability fixed in new versions released today, urging them to patch their servers immediately. Few days lated the U.S.  Cybersecurity and Infrastructure Security Agency (CISA) adds the vulnerability to its catalog of exploited vulnerabilities.","CVE-2024-4040 Vulnerability","Unknown","N/A","N/A","Link"
"43","19/04/2024","10/04/2024","12/04/2024","?","Multiple organizations","Researchers from Fortinet discover a malicious PyPI package named discordpy_bypass-1.7.","Malware","Multiple Industries","Cyber Crime",">1","Link"
"44","19/04/2024","-","-","Sandworm (a.k.a. BlackEnergy, Seashell Blizzard, Voodoo Bear, APT44, UAC-0133)","20 critical infrastructures in Ukraine","The Ukraine Computer Emergency Response Team (CERT-UA) reveal that the Russian  group Sandworm aimed to disrupt operations at around 20 critical infrastructure facilities in Ukraine.","Targeted Attack","Electricity, gas steam, air conditioning","Cyber Warfare","UA","Link"
"45","19/04/2024","Mid-April 2024","Mid-April 2024","?","Individuals actively seeking out child pornography","A new malware campaign is targeting individuals who actively seek out child pornography via a malicious executable called 'CryptVPN'.","Malware","Individual","Cyber Crime",">1","Link"
"46","19/04/2024","18/04/2024","18/04/2024","BlackBasta","Synlab Italia","Synlab Italia suspends all its medical diagnostic and testing services after a ransomware attack forced its IT systems to be taken offline. The BlackBasta ransomware gang claims responsibility for the attack.","Ransomware","Human health and social work","Cyber Crime","IT","Link"
"47","19/04/2024","-","-","?","Mobile Guardian","The names and e-mail addresses of parents and teachers of 127 primary and secondary schools are leaked after Mobile Guardian, a mobile platform on students’ personal learning devices is hacked.","Unknown","Human health and social work","Cyber Crime","SG","Link"
"48","19/04/2024","29/07/2023","01/08/2023","?","Valley Mountain Regional Center","Valley Mountain Regional Center discloses a breach.","Unknown","Human health and social work","Cyber Crime","US","Link"
"49","19/04/2024","19/04/2024","19/04/2024","?","Hedgey Finance","Token infrastructure platform Hedgey Finance undergoes two simultaneous exploits that resulted in a combined loss of $44.7 million","Vulnerability","Fintech","Cyber Crime","US","Link"
"50","20/04/2024","Between 2011 and 2014","Between 2011 and 2014","Threat actors with ties to the Chinese government","Volkswagen","Threat actors associated with the Chinese government are believed to have hacked into Volkswagen systems in an effort to steal valuable data between 2011 and 2014.","Targeted Attack","Manufacturing","Cyber Espionage","DE","Link"
"51","20/04/2024","-","-","LockBit","Union Hospital","The Union Hospital in Hong Kong is hit with an alleged LockBit ransomware attack.","Ransomware","Human health and social work","Cyber Crime","HK","Link"
"52","22/04/2024","-","17/04/2024","?","Users from the gamers' community","Researchers from G Data discover ""Sharp Stealer"", an infostealer focused on the gamers' community.","Malware","Arts entertainment, recreation","Cyber Crime",">1","Link"
"53","22/04/2024","Since November 2023","Since November 2023","?","Toncoin users","Researchers from Kaspersky reveal that scammers have been observed employing a sophisticated tactic to steal Toncoins (TON) from Telegram users globally.","Scam","Fintech","Cyber Crime",">1","Link"
"54","22/04/2024","Since at least June 2020 and possibly as early as April 2019","-","APT28 (a.k.a. Strontium, Forest Blizzard)","Ukrainian, Western European and North American government, non-governmental, education and transportation sector organizations","Researchers from Microsoft reveal that the notorious Russian APT28 group has been stealing credentials for years by exploiting the CVE-2022-38028 Windows Print Spooler bug and using a novel post-compromise tool known as “GooseEgg.”","CVE-2022-38028 Vulnerability","Multiple Industries","Cyber Espionage","UA >1","Link"
"55","22/04/2024","-","-","?","Individuals in South Korea","Researchers from AhnLab discover a campaign distributing phishing files identical to Korean portal website login screens.","Account Takeover","Individual","Cyber Crime","KR","Link"
"56","22/04/2024","During Q1 2024","During Q1 2024","TA427, a.k.a. Emerald Sleet, APT43, THALLIUM or Kimsuky.","Multiple organizations in South Korea","Researchers from Genians uncover a campaign by APT43 exploiting Dropbox to evade detection.","Targeted Attack","Multiple Industries","Cyber Espionage","KR","Link"
"57","22/04/2024","-","17/04/2024","Belarusian Cyber-Partisans","Grodno Azot","Belarusian politically motivated hacktivists from the Belarusian Cyber-Partisans group claim to have attacked the country’s largest state-run manufacturer of fertilizers, Grodno Azot, for its alleged involvement in political repression, sanctions evasion, and human rights violations.","Unknown","Manufacturing","Hacktivism","BY","Link"
"58","22/04/2024","Since at least 2020","Since at least 2020","ToddyCat","Government organizations in the Asia-Pacific region","Researchers from Kaspersky reveal the details of the latest campaign by the ToddyCat threat actors stealing “large volumes of data,” primarily from governmental targets in the Asia-Pacific region.","Targeted Attack","Public admin and defence, social security","Cyber Espionage",">1","Link"
"59","22/04/2024","22/03/2024","22/03/2024","LockBit","Medios de Prevención Externos Sur SL","Medios de Prevención Externos Sur SL, a  medical company servicing Spain's Guardia Civil, is hit with a LockBit ransomware attack.","Ransomware","Human health and social work","Cyber Crime","ES","Link"
"60","22/04/2024","20/06/2023","06/03/2024","?","Lamont Hanley & Associates","Almost 2,800 patients at Catholic Medical Center may have had their files containing personal and health information exposed in a third-party ""data security incident"" occurred to Lamont Hanley & Associates.","Account Takeover","Administration and support service","Cyber Crime","US","Link"
"61","23/04/2024","Since at least 2018.","-","Threat actor with possible ties to Kimsuky","Multiple organizations","Researchers from Avast uncover a campaign where North Korean threat actors have been exploiting the updating mechanism of the eScan antivirus to plant backdoors on big corporate networks and deliver cryptocurrency miners through GuptiMiner malware.","Malware","Multiple Industries","Cyber Crime",">1","Link"
"62","23/04/2024","Since at least February 2024","Since at least February 2024","CoralRaider","Organizations in multiple countries, including the U.S., Nigeria, Pakistan, Ecuador, Germany, Egypt, the U.K., Poland, the Philippines, Norway, Japan, Syria and Turkey","Researchers from Cisco Talos discover a new ongoing malware campaign distributing three different stealers, such as CryptBot, LummaC2, and Rhadamanthys hosted on Content Delivery Network (CDN) cache domains.","Malware","Multiple Industries","Cyber Crime","DE EC EG GB JP NG NO PH PK PL SY TR US","Link"
"63","23/04/2024","Between October 2022 and July 2023","Between October 2022 and July 2023","Lazarus, Kimsuky and Andariel.","83 defense contractors in South Korea","The Korean National Police Agency (KNPA) reveal the details of a major campaign carried out by threat actors from North Korea, and targeting as many as 83 defense contractors and subcontractors, 10 of which had sensitive information stolen.","Targeted Attack","Public admin and defence, social security","Cyber Espionage","KR","Link"
"64","23/04/2024","23/04/2024","23/04/2024","?","Czech News Agency (CTK)","An unidentified threat actor hacks the website of Czech News Agency (CTK) a government-owned Czech news service, and publishes a fake story claiming that an assassination attempt had been made against the newly elected Slovak president, Petr Pellegrini.","Unknown","Information and communication","Cyber Crime","CZ","Link"
"65","23/04/2024","-","-","?","Facebook users","Researchers from Malwarebytes uncover a malicious ad campaign targeting Facebook users via Google search.","Malvertising","Individual","Cyber Crime",">1","Link"
"66","23/04/2024","15/04/2024","15/04/2024","?","Meduza","The Russian independent news website Meduza faces repeated attempts to disrupt its digital infrastructure.","DDoS","Information and communication","Cyber Crime","RU","Link"
"67","23/04/2024","-","-","?","Multiple organizations","Researchers from SonicWall discover a malware campaign using a VBA macro in a Word document to download and execute a 64-bit Rust binary. This binary employs fileless injection techniques to load a malicious AgentTesla payload.","Malware","Multiple Industries","Cyber Crime",">1","Link"
"68","23/04/2024","-","-","?","Skanlog","Skanlog, the Swedish logistics company that works with Sweden’s alcohol retail monopoly Systembolagethas, is hit with a ransomware attacks and prompts warnings from the country’s sole liquor retailer that its top shelves in stores around the country may be empty by the end of the week.","Ransomware","Transportation and storage","Cyber Crime","SE","Link"
"69","23/04/2024","-","20/04/2024","Cyber Army of Russia","Tipton Wastewater Treatment Plant","The Cyber Army of Russia claims responsibility for a cyber attack to the Tipton Wastewater Treatment Plant.","Unknown","Water supply, waste mgmt, remediation","Hacktivism","US","Link"
"70","23/04/2024","During February 2024","During February 2024","?","Lincoln Project","The anti-Donald Trump  super PAC Lincoln Project discloses to have lost $35,000 to a business email compromise (BEC) scam.","Business Email Compromise","Other service activities","Cyber Crime","US","Link"
"71","23/04/2024","-","-","CiberInteligenciaSV","Chivo","The threat group CiberInteligenciaSV releases what it says is sensitive information linked to El Salvador's state-operated bitcoin wallet Chivo, releasing source code on the criminal forum BreachForums.","Unknown","Fintech","Cyber Crime","SV","Link"
"72","24/04/2024","Since November 2023","Early 2024","UAT4356 a.k.a. STORM-1849","Government networks worldwide","​Cisco warns about ArcaneDoor, a campaign where a state-backed group tracked as UAT4356 has been exploiting two zero-day vulnerabilities (CVE-2024-20353 and CVE-2024-20359) in Adaptive Security Appliance (ASA) and Firepower Threat Defense (FTD) firewalls to breach government networks worldwide via two malware implants dubbed Line Dancer, and Line Runner.","CVE-2024-20353 and CVE-2024-20359 Vulnerabilities","Public admin and defence, social security","Cyber Espionage",">1","Link"
"73","24/04/2024","'Recently''","'Recently''","?","Multiple organizations","Researchers from Zscaler discover a significant number of websites associated with fraudulent activities being hosted on popular web hosting and blogging platforms, distributing malware via SEO poisoning.","Malware","Multiple Industries","Cyber Crime",">1","Link"
"74","24/04/2024","'Recently''","'Recently''","?","Multiple organizations","Researchers from WPScan reveal that threat actors are attempting to actively exploit CVE-2024-27956, a critical security flaw in the ValvePress Automatic plugin for WordPress that could allow site takeovers.","CVE-2024-27956 Vulnerability","Multiple Industries","Cyber Crime",">1","Link"
"75","24/04/2024","-","-","?","Multiple organizations","Researchers from Netcraft discover a campaign where threat actors are using compromised email accounts to send phishing emails containing links to PDF files hosted on Autodesk Drive.","Account Takeover","Multiple Industries","Cyber Crime",">1","Link"
"76","24/04/2024","-","-","?","Multiple organizations","Researchers from AhnLab discover an Infostealer strain made with Electron.","Malware","Multiple Industries","Cyber Crime",">1","Link"
"77","24/04/2024","17/04/2024","17/04/2024","BlackSuit","Octapharma","The plasma donation company Octapharma suffers a BlackSuit ransomware attack.","Ransomware","Human health and social work","Cyber Crime","CH","Link"
