"ID","Date Reported","Date Occurred","Date Discovered","Author","Target","Description","Attack","Target Class","Attack Class","Country","Link"
"152","14/08/2023","12/06/2023","09/06/2023","?","El Centro Del Barrio (CentroMed)","El Centro Del Barrio d/b/a CentroMed files a notice of data breach after discovering that unauthorized actors were able to access the company’s IT network.","Unknown","Human health and social work","Cyber Crime","US","Link"
"153","14/08/2023","14/08/2023","14/08/2023","?","Electronic Sign","in Surgut, a Siberian oil town, someone hacks an electronic sign, posting insults against President Putin.","Unknown","Unknown","Hacktivism","RU","Link"
"154","14/08/2023","-","-","Medusa","Levare International,","The Medusa ransomware gang blackmails Levare International with a DDoS attack after hitting them with a ransomware.","Malware","Manufacturing","Cyber Crime","UAE","Link"
"155","14/08/2023","14/08/2023","14/08/2023","?","Prince George’s County Public Schools (PGCPS)","Prince George’s County Public Schools (PGCPS) discloses to have suffered a cyber attack.","Unknown","Education","Cyber Crime","US","Link"
"156","14/08/2023","Since 21/07/2022","Since 21/07/2022","?","Multiple blockchains","Researchers from Distrust say that a total of at least $900,000 was stolen across multiple blockchains exploiting the CVE-2023-39910 vulnerability dubbed Milk Sad.","CVE-2023-39910 Vulnerability","Fintech","Cyber Crime",">1","Link"
"157","14/08/2023","14/08/2023","14/08/2023","?","Zunami Protocol","Attackers exploit a price manipulation vulnerability on decentralized finance platform Zunami Protocol to steal more than $2.1 million and launder it via the U.S. government-sanctioned crypto mixer Tornado Cash.","Price Manipulation Vulnerability","Fintech","Cyber Crime","N/A","Link"
"158","14/08/2023","From February to July 2023","From February to July 2023","Multiple threat actors","Multiple organizations","Researchers from Netskope discover multiple phishing campaings making use of Cloudflare R2 to host phishing pages.","Account Takeover","Multiple Industries","Cyber Crime",">1","Link"
"159","15/08/2023","14/08/2023","14/08/2023","Raccoon Stealer","Multiple organizations","Researchers from Cyberint reveal that the developers of Raccoon Stealer information-stealing malware have ended their 6-month hiatus from hacker forums to promote a new 2.3.0 version of the malware to cyber criminals.","Malware","Multiple Industries","Cyber Crime",">1","Link"
"160","15/08/2023","20/07/2023","08/08/2023","?","Multiple organizations","Researchers from Fox-IT reveal that a threat actor has compromised close to 2,000 Citrix NetScaler servers in a massive campaign exploiting the critical-severity remote code execution tracked as CVE-2023-3519.","CVE-2023-3519 Vulnerability","Multiple Industries","Cyber Crime",">1","Link"
"161","15/08/2023","'In recent weeks'","'In recent weeks'","?","LinkedIn Users","Researchers from Cyberint reveal that LinkedIn is being targeted in a wave of account hacks resulting in many accounts being locked out for security reasons or ultimately hijacked by attackers.","Account Takeover","Individual","Cyber Crime",">1","Link"
"162","15/08/2023","-","-","Clop AKA Lace Tempest, TA505 and FIN11","Banco Popular de Puerto Rico","Banco Popular de Puerto Rico, Puerto Rico’s largest bank, joins the victim list of the MOVEit attacks after the personal data of its 82,217 clients were exposed via third-party vendor PricewaterhouseCoopers (PwC).","CVE-2023-34362 Vulnerability","Finance and insurance","Cyber Crime","US","Link"
"163","15/08/2023","-","-","Clop AKA Lace Tempest, TA505 and FIN11","Medicine Camden Clark Medical Center","Medicine Camden Clark Medical Center joins the list of the MOVEit vulnerabilities victims.","CVE-2023-34362 Vulnerability","Human health and social work","Cyber Crime","US","Link"
"164","15/08/2023","-","12/07/2023","Clop AKA Lace Tempest, TA505 and FIN11","First Farmers Bank & Trust","First Farmers Bank & Trust files a notice of data breach after discovering that an unauthorized party was able to access confidential FFBT customer information through the MOVEit vulnerability.","CVE-2023-34362 Vulnerability","Finance and insurance","Cyber Crime","US","Link"
"165","15/08/2023","-","-","Clop AKA Lace Tempest, TA505 and FIN11","University of Massachusetts Chan Medical School (UMass Chan)","University of Massachusetts Chan Medical School (UMass Chan) posts a website notice describing a data breach impacting 134,000 users and resulting from the organization's use of MOVEit.","CVE-2023-34362 Vulnerability","Education","Cyber Crime","US","Link"
"166","15/08/2023","07/02/2023","07/02/2023","?","Advance America Cash Advance Centers of Montana and Advance America Cash Advance Centers of Vermont (Advance America)","Advance America Cash Advance Centers of Montana and Advance America Cash Advance Centers of Vermont (Advance America) file notices of data breach explaining that a cyber incident resulted in an unauthorized party being able to access consumers’ sensitive information.","Unknown","Finance and insurance","Cyber Crime","US","Link"
"167","15/08/2023","-","-","?","Cleveland City Schools","Cleveland City Schools say they are dealing with the aftermath of a ransomware attack.","Unknown","Education","Cyber Crime","US","Link"
"168","15/08/2023","15/08/2023","15/08/2023","?","RocketSwap","Decentralized exchange RocketSwap loses $870,000 in a hack due to multiple vulnerabilities, including storing user private keys on its cloud servers via a brute-force attack.","Brute-force","Finance and insurance","Cyber Crime","N/A","Link"
"169","15/08/2023","-","26/07/2023","?","Johnstown Regional Sewage","Federal and local law enforcement agencies investigate into an alleged phishing scam perpetrated against Johnstown Regional Sewage.","Account Takeover","Water supply, waste mgmt, remediation","Cyber Crime","US","Link"
"170","15/08/2023","15/08/2023","15/08/2023","Medusa","Postel","The Medusa ransomware gang claims responsibility for a cyber attack against Postel, a company controlled by the Italian National Mail.","Malware","Administration and support service","Cyber Crime","IT","Link"
"171","15/08/2023","Since 16/07/2023","Since November 2022","KmsdBot","Multiple organizations","Researchers from Akamai discover an updated version of a botnet malware called KmsdBot,  targeting Internet of Things (IoT) devices.","Malware","Multiple Industries","Cyber Crime",">1","Link"