"ID","Date Reported","Date Occurred","Date Discovered","Author","Target","Description","Attack","Target Class","Attack Class","Country","Link"
"77","08/08/2023","-","-","Sandworm","Ukraine Military","Ukrainian security services say they prevented an attempt by Russian state-controlled hackers from the Sandworm group to break into the battlefield management system used by the Ukrainian military.","Targeted Attack","Public admin and defence, social security","Cyber Espionage","UA","Link"
"78","08/08/2023","-","-","?","Unknown organization(s)","Microsoft provides security updates for 87 flaws, including CVE-2023-36884 and CVE-2023-38180, two actively exploited and twenty-three remote code execution vulnerabilities.","CVE-2023-36884 and CVE-2023-38180 vulnerabilities","Unknown","N/A","N/A","Link"
"79","08/08/2023","-","13/06/2023","Clop AKA Lace Tempest, TA505 and FIN11","Missouri's Department of Social Services","Missouri's Department of Social Services (DSS) warns that protected Medicaid healthcare information was exposed in a data breach after IBM suffered a MOVEit data theft attack.","CVE-2023-34362 Vulnerability","Public admin and defence, social security","Cyber Crime","US","Link"
"80","08/08/2023","29/05/2023","30/05/2023","Clop AKA Lace Tempest, TA505 and FIN11","Global Atlantic Financial Group","Global Atlantic Financial Group files a notice of data breach after discovering the MOVEit-related data breach at Pension Benefit Information.","CVE-2023-34362 Vulnerability","Finance and insurance","Cyber Crime","US","Link"
"81","08/08/2023","Since 2021","Since 2021","RedHotel, AKA TAG-22, Charcoal Typhoon and BRONZE UNIVERSITY","Organizations across at least 17 countries across Asia, Europe and North America","Researchers from Recorded Future reveal that the RedHotel group, affiliated with China’s Ministry of State Security targeted a range of government, telecommunications and research organizations across at least 17 countries since 2021.","Targeted Attack","Multiple Industries","Cyber Espionage",">1","Link"
"82","08/08/2023","08/08/2023","08/08/2023","?","Mayanei Hayeshua Medical Center","The Israeli hospital Mayanei Hayeshua Medical Center, near Tel Aviv, is hit with a ransomware attack, prompting it to stop admitting new patients and redirecting people to nearby hospitals.","Malware","Human health and social work","Cyber Crime","IL","Link"
"83","08/08/2023","08/08/2023","08/08/2023","NoName057(16)","Government and public services websites in France","The pro-Russia collective NoName057(16) claims responsibility for cyberattacks on government and public services websites in France. The list of the targets include the country’s customs service (Direction générale des douanes et droits indirects) and the French financial regulator.","DDoS","Public admin and defence, social security","Hacktivism","FR","Link"
"84","08/08/2023","08/08/2023","08/08/2023","NoName057(16)","Government and public services websites in the Netherlands","The pro-Russia collective NoName057(16) claims responsibility for cyberattacks on government and public services websites in the Netherlands. The list of the target includes: Dutch public transport website, local bank SNS, the Groningen seaport, and the website of the municipality of Vlardingen.","DDoS","Public admin and defence, social security","Hacktivism","NL","Link"
"85","08/08/2023","-","-","K0LzSec","Bank of Ayudhya, also known as Krungsri","The fifth-largest bank in Thailand, the Bank of Ayudhya, also known as Krungsri is allegedly hacked by K0LzSec group.","Unknown","Finance and insurance","Cyber Crime","TH","Link"
"86","08/08/2023","07/08/2023","07/08/2023","UserSec","Birmingham Airport","The UserSec collective takes responsibility for taking down the website of the Birmingham Airport.","DDoS","Transportation and storage","Hacktivism","GB","Link"
"87","08/08/2023","07/08/2023","07/08/2023","UserSec","Birmingham Airport","The UserSec collective takes responsibility for taking down the website of the Belfast Airport.","DDoS","Transportation and storage","Hacktivism","GB","Link"
"88","08/08/2023","-","-","Agniane stealer","Multiple organizations","A new information stealer, dubbed Agniane stealer, emerges on the dark web. promoted in the hacking community.","Malware","Multiple Industries","Cyber Crime",">1","Link"
"89","08/08/2023","-","07/08/2023","Qilin","Thonburi Energy Storage Systems (TESM)","The Qilin ransomware adds Thonburi Energy Storage Systems (TESM) to its victim list.","Malware","Manufacturing","Cyber Crime","TH","Link"
"90","08/08/2023","'Recently'","'Recently'","?","Individuals","Researchers from Cyble discover a new tech scam campaign, involving scammers setting up a non-existent antivirus solution site to deceive users into paying for non-existent services, and leveraging various ransomware variants to propagate the fraudulent schemes.","Scam","Individual","Cyber Crime",">1","Link"
"91","08/08/2023","Over the last two years","-","Lchaia/xmrig","Multiple organizations","Researchers from Aqua Security reveal the details of the Lchaia/xmrig campaign, exploiting misconfigured Kubernetes clusters for cyrptomining.","Misconfiguration","Multiple Industries","Cyber Crime",">1","Link"
"92","08/08/2023","Over the last two years","-","ssww","Multiple organizations","Researchers from Aqua Security reveal the details of the ssww campaign, exploiting misconfigured Kubernetes clusters for cyrptomining.","Misconfiguration","Multiple Industries","Cyber Crime",">1","Link"
"93","08/08/2023","'Recently'","'Recently'","Statc Stealer","Multiple organizations","Researchers from Zscaler discover a new information stealer malware, called Statc Stealer, that can steal a broad range of info from Windows devices.","Malware","Multiple Industries","Cyber Crime",">1","Link"
"94","08/08/2023","04/04/2023","30/05/2023","Karakurt","Jefferson County Health Center","Jefferson County Health Center reveals that unauthorized individuals gained access to its network between April 04, 2023, and May 30, 2023, and may have obtained files containing patients’ protected health information. The Karakurt ransomware gang claims responsibility for the attack.","Malware","Human health and social work","Cyber Crime","US","Link"
"95","08/08/2023","-","-","8base","Oregon Sports Medicine","Oregon Sports Medicine is added to the 8Base ransomware leake site.","Malware","Human health and social work","Cyber Crime","US","Link"
"96","08/08/2023","-","01/08/2023","NoEscape","Kreacta","The NoEscape ransomware gang claims responsibility for a cyber attack to Kreacta, a consulting company in Italy","Malware","Professional, scientific and technical","Cyber Crime","IT","Link"
"97","09/08/2023","Over the last six months","H1 2023","?","Multiple organizations worldwide","Researchers from Proofpoint discover a campaign using 120,000 phishing emails sent to over a hundred organizations to steal Microsoft 365 accounts via the EvilProxy phishing-as-a-service platform.","Account Takeover","Multiple Industries","Cyber Crime",">1","Link"
"98","09/08/2023","-","-","Rhysida","Undisclosed healthcare organization in Australia","The Rhysida ransomware operation lists an undisclosed healthcare organization in Australia in their website.","Malware","Human health and social work","Cyber Crime","AU","Link"
"99","09/08/2023","Since October 2022","During June 2023","Chinese Threat Actors","Multiple organizations","The U.S. Cybersecurity & Infrastructure Security Agency (CISA) discloses the discovery of a backdoor malware named 'Whirlpool' used in attacks on compromised Barracuda Email Security Gateway (ESG) devices.","CVE-2023-2868 Vulnerability","Multiple Industries","Cyber Espionage","US","Link"
"100","09/08/2023","Since 07/08/2023","Since 07/08/2023","Gafgyt","Multiple organizations","Researchers from Fortinet issue an alert warning that the Gafgyt botnet malware is actively trying to exploit CVE-2017-18368, a vulnerability in the end-of-life Zyxel P660HN-T1A router in thousands of daily attacks.","CVE-2017-18368 Vulnerability","Multiple Industries","Cyber Crime",">1","Link"
"101","09/08/2023","'Recently'","'Recently'","Agent Tesla","Individuals","Researchers from Cyble discover a new campaign using “Tax-related documents and accompanying control panel files (CPL)” to deliver the Agent Tesla malware.","Malware","Individual","Cyber Crime",">1","Link"
"102","09/08/2023","Since at least January 2023","Since at least January 2023","Xurum","Multiple organizations","Researchers from Akamai discover Xurum, a campaign targeting ecommerce stores using Adobe's open source Magento 2, exploiting CVE-2022-24086, a critical vulnerability that was patched on 2022.","CVE-2022-24086 Vulnerability","Wholesale and retail","Cyber Crime",">1","Link"
"103","09/08/2023","Since at least 13/07/2023","13/07/2023","?","Organizations in Europe and North America","Researchers from Fortinet discover a new campaign using the Rust-based injector Freeze[.]rs to introduce a combination of XWorm and Remcos.","Malware","Multiple Industries","Cyber Crime",">1","Link"
"104","09/08/2023","-","-","?","Virginia Department of Medical Assistance Services","The Virginia Department of Medical Assistance Services files a notice of data breach after discovering that confidential information in its possession was subject to unauthorized access.","Unknown","Public admin and defence, social security","Cyber Crime","US","Link"
"105","09/08/2023","-","-","Clop AKA Lace Tempest, TA505 and FIN11","EMS Management and Consultants","EMS Management and Consultants files a notice of data breach after discovering that the vulnerability in the MOVEit file transfer system allowed an unauthorized party to access consumer information.","CVE-2023-34362 Vulnerability","Professional, scientific and technical","Cyber Crime","US","Link"
"106","10/08/2023","Since 19/11/2014","-","MoustachedBouncer","Foreign embassies in Belarus","Researchers from ESET discover a cyberespionage group named 'MoustachedBouncer', observed using adversary-in-the-middle (AitM) attacks at ISPs to hack foreign embassies in Belarus.","Targeted Attack","Public admin and defence, social security","Cyber Espionage",">1","Link"
"107","10/08/2023","Early August 2023","Early August 2023","Knight","Multiple organizations","Researchers from Sophos discover a campaign distributing the Knight ransomware in disguise of TripAdvisor complaints.","Malware","Multiple Industries","Cyber Crime",">1","Link"
"108","10/08/2023","-","-","Charming Kitten","Iranian opposition and exiles based in Germany","Germany’s domestic intelligence service (Federal Office for the Protection of the Constitution - BfV) publishes a warning that Iranian dissident organizations and individuals in the country are being targeted by Charming Kitten, a suspected Iranian state-sponsored threat group.","Account Takeover","Individual","Cyber Espionage","DE","Link"
"109","10/08/2023","09/08/2023","-","LockBit 3.0","City of El Cerrito","The California city of El Cerrito investigates the potential theft of data after the LockBit ransomware group adds the city’s government to its list of victims.","Malware","Public admin and defence, social security","Cyber Crime","US","Link"
"110","10/08/2023","In the third and fourth week of March 2023","-","?","Undisclosed Power Generator in South Africa","Researchers from Kaspersky uncover a suspected cyberattack targeting a power generator in southern Africa with Cobalt Strike beacons and DroxiDat, a new variant of the SystemBC payload.","Malware","Electricity, gas steam, air conditioning","Cyber Crime","ZA","Link"
"111","10/08/2023","'Recently'","'Recently'","APT29 (AKA Cozy Bear, Cloaked Ursa, BlueBravo, Midnight Blizzard, The Dukes, UNC2452 and formerly Nobelium)","Foreign ministries of NATO-aligned governments","Researchers from EclecticIQ discover a recent campaign targeting the foreign ministries of NATO-aligned governments with two malicious PDF files camouflaged as diplomatic invitations from a German embassy.","Targeted Attack","Public admin and defence, social security","Cyber Espionage",">1","Link"
"112","10/08/2023","-","09/07/2023","8base","Alberta Dental Service Corporation (ADSC)","Canadian dental benefits administrator Alberta Dental Service Corporation (ADSC) starts informing roughly 1.47 million individuals that their personal information was compromised in a 8base ransomware attack.","Malware","Administration and support service","Cyber Crime","CA","Link"
"113","10/08/2023","During 2023","During 2023","AdLoad","Multiple organizations","Researchers from AT&T discover a new campaign infecting thousands of Mac systems with the AdLoad malware to act as proxy exit nodes.","Malware","Multiple Industries","Cyber Crime",">1","Link"
"114","10/08/2023","Since at least June 2023","During June 2023","?","FinTech users in the LATAM region","Researchers from Zscaler reveal the details of JanelaRAT, a malicious tool used in a campaign targeting FinTech users in the LATAM region.","Malware","Fintech","Cyber Crime",">1","Link"
"115","10/08/2023","06/06/2023","11/06/2023","?","Coastal Orthopedics & Sports Medicine of Southwest Florida","Coastal Orthopedics & Sports Medicine of Southwest Florida posts a “Notice of Privacy Event” on its website after discovering that an unauthorized party was able to gain access to the company’s computer network.","Unknown","Human health and social work","Cyber Crime","US","Link"
"116","10/08/2023","Earlier in 2023","Earlier in 2023","?","City of New Haven","The city of New Haven suffers a $6 million theft in a cyber attack after the Board of Education’s Chief Executive Officer and Chief Operating Officer fall victims of a “business email compromise.","Account Takeover","Public admin and defence, social security","Cyber Crime","US","Link"
"117","11/08/2023","28/05/2023","13/06/2023","Clop AKA Lace Tempest, TA505 and FIN11","Colorado Department of Health Care Policy & Financing (HCPF)","The Colorado Department of Health Care Policy & Financing (HCPF) alerts more than four million individuals of a data breach that impacted their personal and health information, after IBM suffered a MOVEit data theft attack.","CVE-2023-34362 Vulnerability","Public admin and defence, social security","Cyber Crime","US","Link"
"118","11/08/2023","-","-","Clop AKA Lace Tempest, TA505 and FIN11","Fidelity National Information Services (FIS Global)","Fidelity National Information Services (FIS Global) files a notice of data breach after discovering that a vulnerability in the MOVEit file transfer program used by FIS Global compromised consumer information","CVE-2023-34362 Vulnerability","Administration and support service","Cyber Crime","US","Link"
"119","11/08/2023","-","-","Clop AKA Lace Tempest, TA505 and FIN11","Florida Healthy Kids","Florida Healthy Kids join the list of the companies affected by the MOVEit breach after the breach suffered by Maximus, who issued the notification.","CVE-2023-34362 Vulnerability","Human health and social work","Cyber Crime","US","Link"
"120","11/08/2023","-","-","?","Cryptocurrency investors in the U.S.","The FBI warns of an increase in scammers pretending to be recovery companies that can help victims of cryptocurrency investment scams recover lost assets.","Cryptocurrency scam","Fintech","Cyber Crime","US","Link"
"121","11/08/2023","-","-","“Groups and individuals” linked to Chinese intelligence","New Zealand’s diverse ethnic Chinese communities","The New Zealand Security Intelligence Service (NZSIS) accuses China of “ongoing activity in and against New Zealand.”","Targeted Attack","Individual","Cyber Espionage","NZ","Link"
"122","11/08/2023","-","10/08/2023","Akira","Belt Railway Company of Chicago","Belt Railway Company of Chicago, the largest switching and terminal railroad in the U.S. investigates the theft of data after the Akira ransomware group adds the company to its leak site.","Malware","Transportation and storage","Cyber Crime","US","Link"
"123","11/08/2023","-","-","ThreatSec","Government data center in Indonesia","The ThreatSec group takes responsibility for infiltrating a data center under the jurisdiction of the Indonesian government.","Unknown","Public admin and defence, social security","Hacktivism","ID","Link"
"124","11/08/2023","-","10/08/2023","Fredens of Security","India Ministry of Food Processing Industries","A threat actor dubbed Fredens of Security takes credit for exposing  4.5GB, purportedly containing 3 million records linked to India’s Ministry of Food Processing.","Unknown","Public admin and defence, social security","Hacktivism","IN","Link"
"125","11/08/2023","-","10/08/2023","Fredens of Security","India Ministry of Health & Family Welfare","A threat actor dubbed Fredens of Security takes credit for exposing  4.5GB, purportedly containing 3 million records linked to India's Ministry of Health & Family Welfare","Unknown","Public admin and defence, social security","Hacktivism","IN","Link"
"126","11/08/2023","-","10/08/2023","PieWithNothing","Shemaroo Entertainment","A user on a hacker forum is allegedly selling data attributed to Shemaroo Entertainment. The attacker claims that this compromised dataset contains 16.4 million user entries, exposing sensitive details such as email addresses, passwords, phone numbers, and additional personal information.","Unknown","Arts entertainment, recreation","Cyber Crime","IN","Link"
"127","11/08/2023","'Recently'","'Recently'","?","Multiple organizations","Researchers from Cyble discover a campaign distributing the LummaC Stealer via the Amadey Bot to deploy the SectopRAT.","Malware","Multiple Industries","Cyber Crime",">1","Link"
"128","11/08/2023","-","-","?","Individuals in the U.S.","The Better Business Bureau warns again consumers of scammers exploiting the popularity of QR codes to defraud users across the US.","Account Takeover","Individual","Cyber Crime","US","Link"
"129","11/08/2023","02/02/2023","09/03/2023","?","Cummins Behavioral Health Systems","Cummins Behavioral Health Systems files a notice of data breach after confirming the company was the recent victim of a ransomware attack.","Malware","Human health and social work","Cyber Crime","US","Link"
"130","11/08/2023","17/01/2023","During December 2022","?","Hub International Limited","Hub International Limited files a notice of data breach after discovering that files on the company’s IT network were accessed and copied by an unauthorized party.","Unknown","Finance and insurance","Cyber Crime","US","Link"
"131","11/08/2023","'Recently'","'Recently'","?","Law firms in multiple countries","Researcher from Trustwave discover a campaign carried out via the search engine optimization (SEO) water hole technique called Gootloader targeting legal-related search terms and has been identified as a threat to law firms and people doing searches for legal information online.","Malware","Professional, scientific and technical","Cyber Crime","DE ES KR FR PT US","Link"
"132","11/08/2023","","","","Puntozero","Puntozero, the company that provides the IT services to the Italian region of Umbria, is hit with a cyber attack.","Unknown","Professional, scientific and technical","Cyber Crime","IT","Link"
"133","12/08/2023","Since 09/08/2023","09/08/2023","Threat actors from North Korea","Multiple organizations","Researchers from Phylum discover a new wave of malicious npm packages part of an ongoing campaign allegedly launched by North Korean threat actors.","Malware","Multiple Industries","Cyber Espionage",">1","Link"
"134","12/08/2023","Between June 2022 and June 2023.","Between June 2022 and June 2023.","Multiple threat actors","Crypto users in X","Researchers at San Diego State University identify 95,111 scam lists and 87,617 accounts linked to scams between June 2022 and June 2023.","Account Takeover","Fintech","Cyber Crime",">1","Link"
"135","13/08/2023","08/08/2023","08/08/2023","?","Rapattoni","Rapattoni, a real estate property listings in US, confirms to have been hit with a ransomware attack.","Malware","Real estate","Cyber Crime","US","Link"
"136","14/08/2023","Since August 2023","Since August 2023","Monti","Organizations within the legal and government sectors","Researchers from Trend Micro reveal that the Monti ransomware gang has returned, after a two-month break from publishing victims on their data leak site, using a new Linux locker to target VMware ESXi servers, legal, and government organizations.","Malware","Multiple Industries","Cyber Crime",">1","Link"
"137","14/08/2023","-","-","Multiple threat actors","Individuals","Researchers from Hudson Rock discover 120,000 infected systems containing credentials for cybercrime forums, many of the computers belonging to hackers.","Malware","Individual","Cyber Crime",">1","Link"
"138","14/08/2023","-","13/08/2023","Akihirah","Discord.io","The Discord.io custom invite service temporarily shuts down after suffering a data breach exposing the information of 760,000 members.","Unknown","Information and communication","Cyber Crime","N/A","Link"
"139","14/08/2023","-","-","?","Cryptocurrency investors in the U.S.","The FBI is warns of a new tactic used by cybercriminals where they promote malicious ""beta"" versions of cryptocurrency investment apps on popular mobile app stores that are then used to steal crypto.","Malware","Fintech","Cyber Crime","US","Link"
"140","14/08/2023","14/08/2023","14/08/2023","?","Prince George's County Public Schools","Prince George's County Public Schools, one of the largest school districts in the United States, announces that it discovered a cyberattack on its network.","Unknown","Education","Cyber Crime","US","Link"
"141","14/08/2023","-","-","?","Clorox","Cleaning product giant Clorox announces a cybersecurity incident that forced it to take several systems offline.","Unknown","Manufacturing","Cyber Crime","US","Link"
"142","14/08/2023","02/08/2023","02/08/2023","NoEscape","German Federal Bar Association (BRAK)","The German Federal Bar Association (BRAK) suffers a NoEscape ransomware attack.","Malware","Administration and support service","Cyber Crime","DE","Link"
"143","14/08/2023","14/08/2023","14/08/2023","NoName057(16)","Multiple organizations in Poland","The pro-Russia NoName057(16) collective takes down three Polish websites: PKP Polskie Linie Kolejowe, the custodians of Poland’s railway infrastructure, Plus Bank, a financial institution, and the Warsaw Metro.","DDoS","Multiple Industries","Hacktivism","PL","Link"
"144","14/08/2023","-","-","Rhysida","Programa de Atencion Medica Integral (PAMI","The Rhysida ransomware group adds Programa de Atencion Medica Integral (PAMI), an Argentinian public health insurance agency to its victim list.","Malware","Human health and social work","Cyber Crime","AR","Link"
"145","14/08/2023","14/08/2023","14/08/2023","EUTNAIOA","Multiple organizations in Japan including the Ministry of the Environment, The Japan Atomic Power Company, Atomic Energy Society of Japan (AESJ), Nuclear Regulation Authority, Japan Atomic Energy Commission (AEC), Japan Energy Association Wec, and many others.","Hacktivists part of Anonymous (EUTNAIOA) claim to have attacked a large number of websites after the Japanese announcement of the planned release of treated Fukushima wastewater into the ocean.","DDoS","Public admin and defence, social security","Hacktivism","JP","Link"
"146","14/08/2023","-","-","Clop AKA Lace Tempest, TA505 and FIN11","New York Life Insurance Company (NYLIC),","New York Life Insurance Company (NYLIC), one of the world’s largest corporations, admits to have been exposed to the MOVEit Transfer attacks via third-party vendor Pension Benefit Information (PBI).","CVE-2023-34362 Vulnerability","Public admin and defence, social security","Cyber Crime","US","Link"
"147","14/08/2023","Since at least early August 2023","Early August 2023","?","Multiple organizations","Researchers from Uptycs discover a new malicious tool dubbed QwixxRAT (AKA Telegram RAT).","Malware","Multiple Industries","Cyber Crime",">1","Link"
"148","14/08/2023","30/05/2023","-","Clop AKA Lace Tempest, TA505 and FIN11","Alogent Holdings","Alogent Holdings files a notice of data breach related to an incident occurred exploiting the vulnerability in MOVEit, resulting in an unauthorized party being able to access consumers’ sensitive information, which includes their names, account and routing numbers, addresses, phone numbers, check payees and remittance amounts.","CVE-2023-34362 Vulnerability","Professional, scientific and technical","Cyber Crime","US","Link"
"149","14/08/2023","30/05/2023","21/06/2023","Clop AKA Lace Tempest, TA505 and FIN11","TMG Health","VNS Health files a notice of data breach after discovering that TMG Health, a third-party vendor of VNS, experienced a data breach affecting information that VNS provided to the vendor.","CVE-2023-34362 Vulnerability","Human health and social work","Cyber Crime","US","Link"
"150","14/08/2023","21/06/2023","23/06/2023","Clop AKA Lace Tempest, TA505 and FIN11","HCSC Insurance Services Company","Blue Cross and Blue Shield of Illinois file a notice describing a third-party data breach that occurred at HCSC Insurance Services Company. The incident resulted in an unauthorized party being able to access consumers’ sensitive information, which includes their names, addresses, email addresses, phone numbers, dates of birth, Social Security Numbers, claim numbers, bank account numbers and medical service information.","CVE-2023-34362 Vulnerability","Finance and insurance","Cyber Crime","US","Link"
"151","14/08/2023","-","-","?","M&T Bank","M&T Bank files a notice of data breach explaining that an incident resulted in an unauthorized party being able to access consumers’ sensitive information, including their names and financial account information.","Unknown","Finance and insurance","Cyber Crime","US","Link"
