"ID","Date Reported","Date Occurred","Date Discovered","Author","Target","Description","Attack","Target Class","Attack Class","Country","Link"
"83","23/02/2023","-","-","?","Multiple organizations","Researchers at Ahnlab reveal that the operators of the ChromeLoader browser hijacking and adware campaign are now using VHD files named after popular games. Previously, such campaigns relied on ISO-based distribution.","Malware","Multiple Industries","CC",">1","Link"
"84","23/02/2023","During August 2021","-","?","My Rewards","Data belonging to customers of The Good Guys are compromised in a security breach involving the Australian retailer's former third-party supplier, My Rewards.","Unknown","Administration and support service","CC","AU","Link"
"85","23/02/2023","Since 20/01/2023","During January 2023","Multiple threat actors","Multiple organizations","Researchers from Bitdefender report that multiple threat actors are actively exploiting the Zoho ManageEngine CVE-2022-47966 vulnerability in attacks in the wild.","CVE-2022-47966 vulnerability","Multiple Industries","CC",">1","Link"
"86","23/02/2023","Since at least 23/02/2023","Since at least 23/02/2023","Multiple threat actors","Individuals","Security researchers warn about a wave of questionable authenticator apps flooding the Apple App Store and Google Play after Twitter’s recent shift from SMS-based 2FA.","Malware","Individual","CC",">1","Link"
"87","23/02/2023","Between 22/11/2023 and 29/11/2023","28/11/2022","?","Texas Orthopaedics & Sports Medicine (TOSM)","Texas Orthopaedics & Sports Medicine notifies 537 individuals of breach involving some patient information.","Unknown","Human health and social work","CC","US","Link"
"88","23/02/2023","During February 2023","During February 2023","Nevada","American and Hungarian universities and Italian shipping and construction firms","A new massive ransomware operation by the Nevada group compromises over 5,000 victims in Europe and the U.S.","Malware","Multiple Industries","CC","HU IT US","Link"
"89","23/02/2023","-","-","?","Hospital Joaquín Paz Borrero","The Hospital Joaquín Paz Borrero is hit with a ransomware attack.","Malware","Human health and social work","CC","CO","Link"
"90","23/02/2023","04/02/2023","-","RansomHouse","AESCULAPIUS Farmaceutici","AESCULAPIUS Farmaceutici, an Italian producer of pharmaceutical products, is hit with a RansomHouse ransomware attack and has some data leaked.","Malware","Professional, scientific and technical","CC","IT","Link"
"91","23/02/2023","-","-","?","Lawrence General Hospital","Lawrence General Hospital files a notice of data breach after learning that confidential patient information that had been entrusted to the company was leaked following a cybersecurity event.","Unknown","Human health and social work","CC","US","Link"
"92","23/02/2023","-","-","Andariel","Multiple organizations in South Korea","Researchers from ASEC (AhnLab Security Emergency response Center) discover a campaign distributing malware targeting users with vulnerable versions of Innorix Agent.","Malware","Multiple Industries","CE","KR","Link"
"93","24/02/2023","-","-","PlugX","Multiple organizations","Researchers from Trend Micro uncover a new wave of attacks aimed at distributing the PlugX remote access trojan masqueraded as an open-source Windows debugger tool called x32dbg. The legitimate tool allows to examine kernel-mode and user-mode code, crash dumps, or CPU registers.","Malware","Multiple Industries","CC",">1","Link"
"94","24/02/2023","08/07/2022","-","?","Aloha Nursing Rehab Centre (Aloha)","Aloha Nursing Rehab Centre (Aloha) files notice of a data breach after learning that an unauthorized party accessed electronic files containing confidential patient information from the company’s computer network.","Unknown","Human health and social work","CC","US","Link"
"95","24/02/2023","During November 2022","-","?","Crystal Bay Casino","Crystal Bay Casino files notice of a data breach after learning that an unauthorized party accessed files on the company’s computer network containing confidential consumer information.","Unknown","Arts entertainment, recreation","CC","US","Link"
"96","24/02/2023","27/12/2022","16/12/2022","?","Advanced Health Media (AHM)","Advanced Health Media (AHM) files a notice of data breach after learning that an unauthorized party was able to access certain company servers that stored confidential consumer data.","Unknown","Professional, scientific and technical","CC","US","Link"
"97","24/02/2023","Since 2019","-","MedusaLocker","Healthcare organizations in the U.S.","The Health Sector Cybersecurity Coordination Center (HC3) warns organizations in the healthcare about the MedusaLocker ransomware.","Malware","Human health and social work","CC","US","Link"
"98","24/02/2023","Mid-February 2022","Mid-February 2022","ALPHV AKA BlackCat","Encino Energy","Encino Energy, one of the largest private natural gas and oil producers in the U.S., said it has investigated and remediated a recent cyberattack allegedly carried out by the BlackCat ransomware gang.","Malware","Electricity, gas steam, air conditioning","CC","US","Link"
"99","24/02/2023","20/02/2023","20/02/2023","?","Minneapolis Public Schools","Minneapolis Public Schools reveals to be experiencing technical difficulties due to an encryption event due to a ransomware attack.","Malware","Education","CC","US","Link"
"100","24/02/2023","Over the last few days","Over the last few days","?","Individuals","Researchers from Malwarebytes discover a campaign sending out phishing mails that disguise bogus URLs with something called Slinks—shortened Linkedin URLs.","Account Takeover","Individual","CC",">1","Link"
"101","24/02/2023","Since early February 2023","During February 2023","WhiteSnake","Multiple organizations","Researchers from Cyble discover a new malware strain called “WhiteSnake” Stealer designed to extract sensitive information from the victim’s computer.","Malware","Multiple Industries","CC",">1","Link"
"102","24/02/2023","-","-","ALPHV AKA BlackCat","Empresa Distribuidora Del Este (EdeEste)","The Empresa Distribuidora Del Este (EdeEste), an electricity distribution firm, is named on BlackCat’s ransomware leak site. The group claims to have 420 GB of information from the company.","Malware","Electricity, gas steam, air conditioning","CC","DO","Link"
"103","24/02/2023","-","-","Royal","Âncora Sistemas de Fixação","Âncora Sistemas de Fixação, a company specializing in the manufacture and marketing of fasteners for civil construction, is added to the Royal gang’s leak site with 88 GB uploaded to the site at the same time.","Malware","Manufacturing","CC","BR","Link"
"104","24/02/2023","-","-","LocKBit 3.0","La Segunda Seguros","La Segunda Seguros insurance company is named by LockBit on its leaks site with some samples as proof of claims.","Malware","Finance and insurance","CC","AR","Link"
"105","24/02/2023","-","-","Stormous","Zurcal","The Zurcal group, which belongs to the energy saving and efficiency sector, is named by the Stormous ransomware group in its Telegram channel.","Malware","Electricity, gas steam, air conditioning","CC","ES","Link"
"106","24/02/2023","17/02/2023","17/02/2023","?","City of Rosarito","The City of Rosarito discloses to have been hit by a cyber attack.","Unknown","Public admin and defence, social security","CC","MX","Link"
"107","24/02/2023","In recent weeks","In recent weeks","?","Iowa Legislative Hearings","Iowa Legislative Hearings are disrupted by offensive or graphic images or videos while the hearings were taking place.","Zoom bombing","Public admin and defence, social security","CC","US","Link"
"108","24/02/2023","'Recently'","'Recently'","Snip3","Multiple organizations","Researchers from Zscaler observe multiple threat campaigns utilizing the Snip3 crypter, a multi-stage remote access trojan (RAT) loader with new TTPs and available since 2021 as a crypter-as-a-service offering.","Malware","Multiple Industries","CC",">1","Link"
"109","25/02/2023","23/02/2023","23/02/2023","Black Basta?","Dish Network","American TV giant and satellite broadcast provider, Dish Network confirms that a ransomware attack was the cause of a multi-day network and service outage.","Malware","Information and communication","CC","US","Link"
"110","25/02/2023","23/02/2023","23/02/2023","BianLian","Southeastern Louisiana University (SLU)","Southeastern Louisiana University (SLU) posts notice of a potential data breach after certain SLU systems were down in response to what the school characterized as a “Temporary Network and System Disruption."" The BianLian ransomware gang claims responsibility for the attack.","Unknown","Education","CC","US","Link"
"111","26/02/2023","26/02/2023","26/02/2023","Anonymous Sudan (affiliated to Killnet)","Nine Danish hospitals","A series of distributed-denial-of-service (DDoS) attacks shut down nine Danish hospitals' websites for a few hours, but did not have any life-threatening impact on the medical centers' operations or digital infrastructure.","DDoS","Human health and social work","H","DK","Link"
"112","26/02/2023","26/02/2023","26/02/2023","?","Tennessee State University (TSU)","Tennessee State University (TSU) posts a “Notice of Suspicious Network Activity” after the institution experienced what it believes to have been a ransomware attack.","Malware","Education","CC","US","Link"
"113","26/02/2023","Since November 2022","Since November 2022","TA569","Multiple organizations","Researchers from Proofpoint reveal the details of a new campaign by TA569 delivering the SocGholish payload via Javascript injections in compromised websites.","Malware","Multiple Industries","CC",">1","Link"
"114","26/02/2023","25/02/2023","25/02/2023","?","Multiple organizations","Researchers from Sonatype discover an open source malware campaign in which a threat actor is infiltrating the PyPI software registry with thousands of malicious packages.","Malware","Multiple Industries","CC",">1","Link"
"115","27/02/2023","-","-","?","Multiple organizations","Researchers at Prodaft reveal that the RIG Exploit Kit currently targets 207 countries, launching an average of 2,000 attacks per day and having a current success rate of 30%.","CVE-2021-26411, CVE-2016-0189, CVE-2019-0752, CVE-2019-8174, CVE-2019-0674, CVE-2019-6332 vulnerabilities","Multiple Industries","CC",">1","Link"
"116","27/02/2023","-","-","?","Multiple organizations","Researchers from Patchstack reveal that threat actors are actively exploiting two critical-severity vulnerabilities in the Houzez theme and plugin for WordPress, two premium add-ons used primarily in real estate websites.","CVE-2023-26540 and CVE-2023-26009 vulnerabilities","Multiple Industries","CC",">1","Link"
"117","27/02/2023","Since 27/11/2022","27/11/2022","Exfiltrator-22","Multiple organizations","Researchers at CYFIRMA discover a new 'Exfiltrator-22' post-exploitation framework, allegedly created by former Lockbit 3.0 affiliates, and designed to spread ransomware in corporate networks while evading detection.","Malware","Multiple Industries","CC",">1","Link"
"118","27/02/2023","Between 12/08/2022 and 26/10/2022","-","?","LastPass","LastPass discloses more information on a ""coordinated second attack,"" where a threat actor accessed and stole data from the Amazon AWS cloud storage servers for over two months.","Account Takeover","Professional, scientific and technical","CC","US","Link"
"119","27/02/2023","17/02/2023","17/02/2023","?","U.S. Marshals Service (USMS)","The U.S. Marshals Service (USMS) is investigating the theft of sensitive law enforcement information following a ransomware attack that has impacted what it describes as ""a stand-alone USMS system.""","Malware","Public admin and defence, social security","CC","US","Link"
"120","27/02/2023","-","-","Multiple threat actors","Organizations in the U.S.","The U.S. Cybersecurity & Infrastructure Security Agency (CISA) adds CVE-2022-36537 impacting the ZK Framework, to its ""Known Exploited Vulnerabilities Catalog"" after threat actors began actively exploiting the remote code execution (RCE) flaw in attacks.","CVE-2022-36537 Vulnerabilities","Multiple Industries","N/A","US","Link"
"121","27/02/2023","-","07/02/2023","?","Pipefitters Local 537","A cyberattack on Pipefitters Local 537, a Boston-based labor union’s health fund, results in the loss of $6.4 million.","Account Takeover","Human health and social work","CC","US","Link"
"122","27/02/2023","Since Q4 2021","-","DIgital Smoke","Internet users from multiple countries","Researchers from Resecurity identify Digital Smoke, one of the largest investment fraud networks by size and volume of operations created to defraud Internet users from Australia, Canada, China, Colombia, the European Union, India, Singapore, Malaysia, United Arab Emirates, Saudi Arabia, Mexico, the U.S. and other regions.","Investment scam","Individual","CC",">1","Link"
"123","27/02/2023","20/02/2023","20/02/2023","APT-C-36 AKA Blind Eagle","Key industries in Colombia and Ecuador, including health, financial, law enforcement, immigration, and an agency in charge of peace negotiation in the country.","Researchers from Blackberry discover a new campaign by APT-C-36, where the threat actor impersonated a Colombian government tax agency to target key industries in Colombia.","Targeted Attack","Multiple Industries","CE","CO EC","Link"
"124","27/02/2023","14/02/2023","14/02/2023","LockBit 3.0","Pierce Transit","Pierce Transit discloses to have been hit with a LockBit 3.0 ransomware attack.","Malware","Transportation and storage","CC","US","Link"
"125","27/02/2023","During December 2022","During December 2022","?","At least 3,000 Texans with Asian surnames","An organized crime group obtains thousands of replacement Texas driver licenses and sends the replacement licenses to Chinese nationals in the country illegally.","Account Takeover","Individual","CC","US","Link"
"126","27/02/2023","27/02/2023","27/02/2023","?","Italian Taxpayers","A new campaign targets the Italian taxpayer with fake notifications from the italian Institute for Social Security (INPS)","Account Takeover","Individual","CC","IT","Link"
"127","28/02/2023","Between 30/01/2023 and 31/01/2023","07/02/2023","?","Hatch Bank","Hatch Bank, a digital-first bank that provides infrastructure for fintech companies offering their own brand credit cards, confirms that attackers exploited the Fortra’s GoAnywhere CVE-2023-0669 zero-day vulnerability in the company’s internal file transfer software that allowed access to thousands of customer Social Security numbers.","CVE-2023-0669 Vulnerability","Fintech","CC","US","Link"
"128","28/02/2023","-","-","Snatch","Ingenico","The Russian ransomware gang Snatch claims to have stolen data from Ingenico, a merchant services technology company based in France.","Malware","Professional, scientific and technical","CC","FR","Link"
"129","28/02/2023","Between late 2022 and early 2023","'Recently'","Winnti, AKA APT41, Barium, Blackfly, Bronze Atlas, Double Dragon, Wicked Panda, and Wicked Spider","Two subsidiaries of an Asian conglomerate in the materials and composites sector","Researchers from Symantec/Broadcom discover a new campaign by the Chinese Winnti group targeting two subsidiaries of an Asian conglomerate in the materials and composites sector.","Targeted Attack","Professional, scientific and technical","CE","N/A","Link"
"130","28/02/2023","'Recently'","'Recently'","SCARLETEEL","Undisclosed organization","Researchers from Sysdig discover an advanced hacking operation dubbed 'SCARLETEEL' targeting public-facing web apps running in containers to infiltrate cloud services and steal sensitive data.","Misconfiguration","Unknown","CC","N/A","Link"
"131","28/02/2023","27/02/2023","27/02/2023","?","Users of the Trezor hardware cryptocurrency wallet","An ongoing phishing campaign is pretending to be Trezor data breach notifications attempting to steal a target's cryptocurrency wallet and its assets.","Account Takeover","Fintech","CC",">1","Link"
"132","28/02/2023","Between January and February of 2023","Between January and February of 2023","?","Several law firms","Researchers from eSentire discover a malicious campaign targeting law firms with the GootLoader malware.","Malware","Professional, scientific and technical","CE","N/A","Link"
"133","28/02/2023","Between January and February of 2023","Between January and February of 2023","?","Several law firms","Researchers from eSentire discover a malicious campaign targeting law firms with the SocGholish malware.","Malware","Professional, scientific and technical","CE","N/A","Link"
"134","28/02/2023","'Recently'","'Recently'","Parallax","Multiple organizations","Researchers at Uptycs detect active samples of the Parallax remote access Trojan (RAT) targeting cryptocurrency organizations.","Malware","Fintech","CC",">1","Link"
"135","28/02/2023","-","-","?","Veris Residential","Veris Residential files a notice of data breach following a cybersecurity incident that leaked confidential consumer information.","Unknown","Real estate","CC","US","Link"
"136","28/02/2023","-","13/12/2022","?","Compass Behavioral Health","Compass Behavioral Health discloses a data security incident that involved the protected health information (PHI) of 1,064 patients.","Account Takeover","Human health and social work","CC","US","Link"
"137","28/02/2023","Since January 2023","Since January 2023","?","Job seekers","Researchers from Trellix reveal that threat actors are exploiting the ongoing economic downturn by using job-themed phishing and malware campaigns to target job seekers and employers to steal sensitive information and hack company recruiters.","Malware","Individual","CC",">1","Link"
"138","28/02/2023","31/10/2022","31/10/2022","Sour Grapes","Individuals","Researchers from Sophos uncover a scam ring run by Chinese criminals named 'Sour Grapes'","Pig-butchering scam","Individual","CC",">1","Link"
"139","28/02/2023","Since 13/01/2023","-","r3nin","Multiple e-commerce sites","Researchers from Cyble discover R3NIN Sniffer, a ready-to-use toolkit and panel for stealing payment card data from compromised e-commerce websites on sale in a notorious Russian-language cybercrime forum.","Malicious Script injection","Wholesale and retail","CC",">1","Link"
"140","28/02/2023","-","27/02/2023","LockBit 3.0","White Settlement Independent School District","LockBit adds White Settlement Independent School District in Texas to their leak site, with a proof pack that suggests that the threat actors were able to access and may have exfiltrated a lot of files.","Malware","Education","CC","US","Link"
"141","28/02/2023","-","-","?","Federación de Aseguradores Colombianos (Fasecolda)","The Federación de Aseguradores Colombianos (Fasecolda), an association for Colombian insurers, suffers a cyber attack.","Unknown","Administration and support service","CC","CO","Link"
"142","28/02/2023","06/02/2023","06/02/2023","?","Oregon City","Oregon City discloses to have been hit by a sophisticated ransomware attack.","Malware","Public admin and defence, social security","CC","US","Link"
"143","28/02/2023","During December and January 2022","During December and January 2022","LockBit 3.0","Multiple organizations","Researchers from Fortinet discover a new LockBit ransomware campaign using a combination of techniques effective against AV and EDR solutions.","Malware","Multiple Industries","CC",">1","Link"
"144","28/02/2023","During February 2022","-","Chinese state-sponsored threat actors","Association of Southeast Asian Nations (ASEAN)","Chinese state-sponsored threat actors managed to breach the mail servers operated by the Association of Southeast Asian Nations, stealing a trove of data that may have contained strategic information about the economy and politics of member countries.","Targeted Attack","Extraterritorial orgs and bodies","CE","N/A","Link"