"ID","Date Reported","Date Occurred","Date Discovered","Author","Target","Description","Attack","Target Class","Attack Class","Country","Link"
"1","16/02/2023","16/02/2023","16/02/2023","Killnet","Websites of several German airports including: Hannover, Dortmund, Nuremberg, Karlsruhe/Baden-Baden, Dusseldorf, Erfurt-Weimar","The websites of several German airports are hit by a DDoS attack launched by the Killnet pro-Russian group.","DDoS","Transportation and storage","H","DE","Link"
"2","16/02/2023","Since at least 08/02/2023","08/02/2023","RansomExx2","Vulnerable ESXi servers","Researchers from Rapid7 reveal that the RansomExx2 ransomware gang is also targeting the VMware CVE-2021-21974 vulnerability.","CVE-2021-21974 Vulnerability","Multiple Industries","CC",">1","Link"
"3","16/02/2023","-","-","WIP26","Telecommunication providers in the Middle East","Researchers at Sentinel One discover a new threat cluster tracked as WIP26 targeting telecommunication providers in the Middle East.","Targeted Attack","Information and Communication","CC",">1","Link"
"4","16/02/2023","Since January 2022","During January 2022","Earth Yako","Researchers in the academic sector and think tanks","Researchers at Trend Micro discover a new campaign of the Earth Yako group targeting researchers in the academic sector and think tanks in Japan.","Targeted Attack","Education","CE","JP","Link"
"5","16/02/2023","-","-","?","Multiple organizations in Taiwan","Researchers from Broadcom/Symantec discover an unknown threat actor deploying a new malware named 'Frebniis' on Microsoft's Internet Information Services (IIS) that stealthily executes commands sent via web requests.","Malware","Multiple Industries","N/A","TW","Link"
"6","16/02/2023","-","15/02/2023","SiegedSec","Atlassian","A hacking crew called SiegedSec posts data on what appears to be thousands of employees and floor plans for two of the company's offices. The company admits that the hack was carried out using accounts stolen from Envoy, a third-party.","Account Takeover","Professional, scientific and technical","CC","AU","Link"
"7","16/02/2023","Since at least January 2021","-","Midnight Hedgehog","Multiple organizations","Researchers from Abnormal Security discover Midnight Hedgehog, a group leveraging Google Translate for Business Email Compromise attacks.","Business Email Compromise","Multiple Industries","CC","DE DK EE ES IT FR HU NL NO PL SE","Link"
"8","16/02/2023","Since at least February 2021","-","Mandarin Capybara","Multiple organizations","Researchers from Abnormal Security discover Mandarin Capybara, a group leveraging Google Translate for Business Email Compromise attacks.","Business Email Compromise","Multiple Industries","CC","AU CA FR DE ES IT PL PT SE NL US","Link"
"9","16/02/2023","Since November 2022","During November 2022","?","Organizations in Armenia","Researchers from Check Point discover Operation Silent Watch, a malicious campaign against entities in Armenia with a new version of a backdoor tracked as OxtaRAT, an AutoIt-based tool for remote access and desktop surveillance.","Targeted Attack","Multiple Industries","CE","AM","Link"
"10","16/02/2023","End of November 2022","End of November 2022","?","Individuals","Researchers from Avanan discover a campaign leveraging the online payments system PayPal to send malicious invoices directly to users through the platform.","Account Takeover","Individual","CC",">1","Link"
"11","16/02/2023","-","08/02/2023","?","Succession Wealth","British independent advice firm Succession Wealth confirmed a cyberattack","Unknown","Finance and insurance","CC","UK","Link"
"12","16/02/2023","-","-","?","Hogwarts Legacy players","Researchers from Malwarebytes discover a campaign distributing fake Hogwarts Legacy cracks dropping adware.","Malware","Arts entertainment, recreation","CC",">1","Link"
"13","16/02/2023","'Recently'","'Recently'","?","Romanian telecom customers","Researchers from Heimdal discover a massive smishing campaign, targeting Romanian telecom customers.","Account Takeover","Information and communication","CC","RO","Link"
"14","16/02/2023","Since at least May 2022","Between August 2022 and January 2023","?","Chinese-speaking individuals in Southeast and East Asia","Researchers from ESET discover a campaign targeting Chinese-speaking individuals in Southeast and East Asia via rogue Google Ads that deliver remote access trojans such as FatalRAT to compromised machines.","Malware","Individual","CC","CN HK ID JP MY MM PH SG TH TW","Link"
"15","16/02/2023","16/02/2023","16/02/2023","?","Platypus","Decentralized finance protocol Platypus, suffers a fresh loan attack causing $8.5 million drained from the protocol. The suspect is identified shortly after.","Fresh loan","Fintech","CC","N/A","Link"
"16","16/02/2023","Since November 2022","Since November 2022","CatB","Multiple organizations","Researchers from Fortinet reveal the details of a new ransomware variant named CatB","Malware","Multiple Industries","CC",">1","Link"
"17","16/02/2023","-","-","?","Over 50 WordPress sites worldwide","Researchers from Malwarebytes discover a malicious campaign targeting WordPress blogs with a fraudulent ad plugin called fuser-master.","Malicious WordPress plugin","Multiple Industries","CC",">1","Link"
"18","16/02/2023","-","-","SideCopy","Indian government entities","Researchers from ThreatMon discover a spear-phishing campaign carried out by a Pakistani threat actor named SideCopy targeting Indian government entities to deploy an updated version of a backdoor called ReverseRAT.","Targeted Attack","Public admin and defence, social security","CE","IN","Link"
"19","16/02/2023","12/02/2023","12/02/2023","?","Sweetwater Union High School District","Sweetwater Union High School District is hit with 'undefined' outage.","Unknown","Education","CC","US","Link"
"20","16/02/2023","During January 2023","During January 2023","?","CIty of Hilliard","The City of Hilliard loses $219,000 to an attacker pretending to be an existing vendor and persuading the finance to change bank-routing information for the vendor.","Account Takeover","Public admin and defence, social security","CC","US","Link"
"21","16/02/2023","-","-","LockBit 3.0","Trudi","The LockBit ransomware gang claims to have hit Trudi, an italian manufacturer of soft toys.","Malware","Manufacturing","CC","IT","Link"
"22","17/02/2023","17/02/2023","17/02/2023","?","U.S. Federal Bureau of Investigation (FBI)","The U.S. Federal Bureau of Investigation (FBI) is reportedly investigating malicious cyber activity on the agency’s network involving an FBI New York Field Office computer system used to investigate child sexual exploitation.","Unknown","Public admin and defence, social security","CC","US","Link"
"23","17/02/2023","Since at least March 2020","-","?","GoDaddy","Web hosting giant GoDaddy says it suffered a breach where unknown attackers have stolen source code and installed malware on its servers after breaching its cPanel shared hosting environment in a multi-year attack.","Malware","Information and communication","CC","US","Link"
"24","17/02/2023","Since at least December 2021","-","8 individuals from France and Israel)","Multiple organizations in France","Europol dismantles a Franco-Israeli ‘CEO fraud’ group that employed business email compromise (BEC) attacks to divert payments from organizations to bank accounts under the threat actor's control.","Business Email Compromise","Multiple Industries","CC","FR","Link"
"25","17/02/2023","Since at least the end of 2022","During the end of 2022","Earth Kitsune","Individuals showing an interest in North Korea","Researchers from Trend Micro discover a new backdoor called WhiskerSpy used in a campaign from the advanced threat actor tracked as Earth Kitsune, targeting individuals showing an interest in North Korea.","Targeted Attack","Individual","CE","BR CN JP","Link"
"26","17/02/2023","-","05/02/2023","?","Coinbase","Coinbase cryptocurrency exchange platform has disclosed that an unknown threat actor stole the login credentials of one of its employees in an attempt to gain remote access to the company's systems.","Account Takeover","Fintech","CC","US","Link"
"27","17/02/2023","-","-","?","Dole Food Company","Dole Food Company, one of the world’s largest producers and distributors of fresh fruit and vegetables, announces that it is dealing with a ransomware attack that impacted its operations.","Malware","Accommodation and food service","CC","IE","Link"
"28","17/02/2023","'Recently'","17/02/2023","Seize","TELUS","Canada's second-largest telecom, TELUS investigates a potential data breach after a threat actor shares samples online of what appears to be employee data. The threat actor subsequently posts screenshots that apparently show private source code repositories and payroll records held by the company.","Unknown","Information and communication","CC","CA","Link"
"29","17/02/2023","Between 13/02/2023 and 15/02/2023","Between 13/02/2023 and 15/02/2023","?","Disney+ accounts of French customers","Researchers at Bitdefender uncover a phishing campaign targeting Disney+ accounts of French customers.","Account Takeover","Arts entertainment, recreation","CC","FR","Link"
"30","17/02/2023","-","-","?","Individuals in Europe, North America, Asia and Australia","Researchers from BitDefender discover an email scam trying to profit off the Turkey-Syria earthquake.","Scam","Individual","CC",">1","Link"
"31","17/02/2023","-","05/11/2022","?","Cleveland Brothers Holdings (CBH)","Cleveland Brothers Holdings (CBH) files a notice of data breach after learning that “unusual activity” on the company’s network resulted in an unauthorized party gaining access to confidential consumer information.","Unknown","Wholesale and retail","CC","US","Link"
"32","17/02/2023","Between 13/05/2022 and 16/05/2022","13/05/2022","?","Rockler Companies","Rockler Companies files a notice of data breach following a data security incident resulting in the personal information of 8,604 consumers being leaked.","Unknown","Manufacturing","CC","US","Link"
"33","17/02/2023","Between 19/12/2022 and 21/12/2022","21/12/2022","?","Hutchinson Clinic","Hutchinson Clinic posts notice of a data breach about an incident resulting in an unauthorized party gaining access to consumers’ names, contact information, dates of birth, Social Security numbers, driver’s license numbers, health insurance information, medical record numbers, medical history, diagnoses, and treatment information, and physician names.","Unknown","Human health and social work","CC","US","Link"
"34","17/02/2023","During August 2022","During August 2022","?","Tom James Company","Tom James Company files notice of a data breach after experiencing a ransomware attack that compromised the security of information stored on the company’s computer network.","Malware","Manufacturing","CC","US","Link"
"35","17/02/2023","-","-","?","O’Neal Industries","O’Neal Industries files notice of a data breach after learning that confidential consumer information stored on the company’s computer network was accessible to an unauthorized party.","Unknown","Manufacturing","CC","US","Link"
"36","17/02/2023","27/08/2022","-","?","Paul Smith’s College","Paul Smith’s College files notice of a data breach after learning that an unauthorized party gained access to its computer systems where they were able to access confidential information belonging to certain students and employees.","Unknown","Education","CC","US","Link"
"37","17/02/2023","During February 2023","During February 2023","LockBit 3.0","Grupo Albanesi","Grupo Albanesi, a private company dedicated to the distribution of energy in Argentina, is added to LockBit3.0’s ransomware leak site.","Malware","Electricity, gas steam, air conditioning","CC","AR","Link"
"38","17/02/2023","17/07/2021","20/08/2021","?","Dental Health Management Solutions (DHMS)","Dental Health Management Solutions (DHMS) announces that the protected health information of 3,205 patients was exposed in a 2021 hacking incident.","Unknown","Human health and social work","CC","US","Link"
"39","18/02/2023","-","-","LockBit 3.0","Aguas do Porto","The LockBit ransomware gang claims to have hacked Aguas do Porto, a Portuguese municipal water utility company, and is threatening to leak the stolen data.","Malware","Water supply, waste mgmt, remediation","CC","PT","Link"
"40","20/02/2023","Since at least January 2023","During January 2023","?","Multiple organizations","Researchers from Sekoia discover a new information stealer called Stealc with stealing capabilities and similarities with malware of the same kind like Vidar, Raccoon, Mars, and Redline.","Malware","Multiple Industries","CC",">1","Link"
"41","20/02/2023","Since November 2022","During November 2022","HardBit 2.0","Multiple organizations","Researchers at Varonis reveal the details of a new version of the HardBit ransomware.","Malware","Multiple Industries","CC",">1","Link"
"42","20/02/2023","02/12/2022","04/12/2022","?","Activision","Activision confirms that it suffered a data breach in early December 2022 after hackers gained access to the company's internal systems by tricking an employee with an SMS phishing text. Few days later the threat actors leak some data allegedly stolen from the company.","Account Takeover","Arts entertainment, recreation","CC","US","Link"
"43","20/02/2023","Since September 2021","-","?","GDS Holdings Ltd","Researchers from Resecurity warn data center organizations about malicious cyber activity targeting them and their customers.","CN","Information and communication","CC","CN","Link"
"44","20/02/2023","Since September 2021","-","?","ST Telemedia Global Data Centres","Researchers from Resecurity warn data center organizations about malicious cyber activity targeting them and their customers.","CN","Information and communication","","SG","Link"
"45","20/02/2023","06/02/2023","06/02/2023","ALPHV AKA BlackCat","Lehigh Valley Health Network (LVHN)","Lehigh Valley Health Network (LVHN) is hit with a BlackCat ransomware attack.","Malware","Human health and social work","CC","US","Link"
"46","20/02/2023","27/01/2023","31/01/2023","‘Portugal’ and ‘Brazil’","Multiple organizations","Researchers from Fortinet discover another 0-day attack in the PyPI packages (Python Package Index) by the malware authors ‘Portugal’ and ‘Brazil’ who published the packages ‘xhttpsp’ and ‘httpssp’.","Malware","Multiple Industries","CC",">1","Link"
"47","20/02/2023","During December 2022","20/02/2023","UNIT82","RailYatri","RailYatri, a popular Indian train ticket booking platform, suffers a massive data breach that exposes the personal information of over 31 million (31,062,673) users/travellers.","Unknown","Transportation and storage","CC","IN","Link"
"48","20/02/2023","'Recently'","'Recently'","?","Virgin Media Television","Virgin Media Television, the Irish broadcaster, says that an attempted hack was going to impact its programming in coming days.","Unknown","Information and communication","CC","IE","Link"
"49","20/02/2023","Since Q4 2022","During Q4 2022","?","Multiple organizations","Researchers from Cyble reveal an uptick of campaigns launched via the DarkCloud Stealer malware.","Malware","Multiple Industries","CC",">1","Link"
"50","20/02/2023","20/02/2023","20/02/2023","?","Crypto investors","A fake website of the popular Ethereum Denver conference is able to steal over $300,000 worth of Ether.","Account Takeover","Fintech","CC","US","Link"
"51","20/02/2023","During January 2023","During January 2023","0mega","Aviacode","The 0mega ransomware gangs dumps 200 GB of data allegedly stolen from Aviacode.","Malware","Professional, scientific and technical","CC","US","Link"
"52","20/02/2023","19/02/2023","19/02/2023","?","ASL5 La Spezia","The ASL5 La Spezia, the local health service of the city of La Spezia, suffers a serious cyber attack and as a consequence multiple services are disrupted.","Unknown","Human health and social work","CC","IT","Link"
"53","21/02/2023","21/02/2023","21/02/2023","IT Army of Ukraine","All-Russia State Television and Radio Broadcasting Company (VGTRK)","A suspected distributed denial of service (DDoS) attack downs several websites broadcasting President Putin’s state on the nation. IT Army of Ukraine claims responsibility for the attack.","DDoS","Information and communication","H","RU","Link"
"54","21/02/2023","-","20/02/2023","?","Multiple organizations","Researchers from Checkmarx discover that threat actors upload over 15,000 spam packages to the npm open-source JavaScript repository.","Account Takeover","Multiple Industries","CC",">1","Link"
"55","21/02/2023","-","-","?","Multiple organizations","Researchers from CloudSEK observe threat actors exploiting CVE-2023-21752, a privilege escalation vulnerability on the Windows Backup and Restore service.","CVE-2023-21752 Vulnerability","Multiple Industries","CC",">1","Link"
"56","21/02/2023","Between 07/09/2022 and 14/09/2022","-","?","Emtec","Emtec files notice of a data breach, after determining that confidential consumer information was leaked following a cyberattack.","Unknown","Professional, scientific and technical","CC","US","Link"
"57","21/02/2023","-","-","?","Henrico Doctors' Hospital","Henrico Doctors' Hospital notifies 990 patients that some of their protected health information was compromised in a data breach after detecting suspicious activity within its information network.","Unknown","Human health and social work","CC","US","Link"
"58","21/02/2023","Since July 2022","Since July 2022","?","Multiple WordPress sites","Researchers from Sucuri discover a new campaign by the Konami Code Backdoor abusing cron jobs to reinfect the compromised WordPress sites.","Malicious WordPress plugin","Multiple Industries","CC",">1","Link"
"59","21/02/2023","'Recently'","'Recently'","?","Multiple organizations","Researchers from Malwarebytes discover a Magecart skimmer involved in a fingerprinting campaign, and abusing the Cloudflare endpoint API.","Malicious Script injection","Wholesale and retail","CC",">1","Link"
"60","21/02/2023","-","-","BlackBasta","KFI Engineers","KFI Engineers pays a $300k ransom, to the Black Basta ransomware gang.","Malware","Professional, scientific and technical","CC","US","Link"
"61","21/02/2023","21/02/2023","21/02/2023","?","Hope Finance","Hope Finance loses $2M cryptocurrency worth after falling victim of a smart contract exploit.","Smart contract vulnerability","Fintech","CC","N/A","Link"
"62","22/02/2023","22/02/2023","22/02/2023","NoName057(16)","Multiple organizations in Italy","The Russian group NoName057(16) targets some Italian institutions and companies following a visit by Italy’s prime minister Giorgia Meloni to Ukraine. Targets include Italy’s Foreign Ministry, Defense Ministry, Interior Ministry, and Telecom Italia","DDoS","Public admin and defence, social security","H","IT","Link"
"63","22/02/2023","22/02/2023","22/02/2023","?","Radio stations across multiple Russian cities","Radio stations across multiple Russian cities are hacked and blast fake air raid warnings.","Unknown","Information and communication","H","RU","Link"
"64","22/02/2023","22/02/2023","22/02/2023","ALPHV AKA BlackCat","CIty of Lakewood","The BlackCat ransomware gang (ALPHV) lists the City of Lakewood on its data leak site.","Malware","Public admin and defence, social security","H","US","Link"
"65","22/02/2023","Since at least October 2022","During October 2022","Hydrochasma","Shipping and medical laboratories involved in COVID-19 vaccine development and treatments in Asia","Researchers from Broadcom/Symantec discover a previously unknown threat actor named Hydrochasma targeting shipping and medical laboratories involved in COVID-19 vaccine development and treatments.","Targeted Attack","Professional, scientific and technical","CE",">1","Link"
"66","22/02/2023","Between July and December 2022","-","S1deload Stealer","YouTube and Facebook users","Researchers from BitDefender discover an ongoing malware campaign targeting YouTube and Facebook users with a new information stealer dubbed S1deload Stealer able to hijack their social media accounts and use their devices to mine for cryptocurrency.","Malware","Individual","CC",">1","Link"
"67","22/02/2023","Since 22/02/2023","22/02/2023","Multiple threat actors","Multiple organizations","Threat actors are targeting Internet-exposed Fortinet appliances with exploits targeting CVE-2022-39952, an unauthenticated file path manipulation vulnerability in the FortiNAC webserver that can be abused for remote command execution.","CVE-2022-39952 Vulnerability","Multiple Industries","CC",">1","Link"
"68","22/02/2023","Since at least 12/02/2023","12/02/2023","Multiple threat actors","Individuals","Threat actors are exploiting the popularity of OpenAI's ChatGPT chatbot to distribute malware for Windows and Android, or direct unsuspecting victims to phishing pages.","Malware","Individual","CC",">1","Link"
"69","22/02/2023","-","-","Multiple threat actors","Organizations the U.S.","The US Cybersecurity and Infrastructure Security Agency (CISA) warns organizations that two vulnerabilities affecting the Mitel MiVoice Connect business communications platform have been exploited in the wild.","CVE-2022-41223 and CVE-2022-40765 vulnerabilities","Multiple Industries","CC","US","Link"
"70","22/02/2023","-","-","Multiple threat actors","Organizations the U.S.","The US Cybersecurity and Infrastructure Security Agency (CISA) warns organizations that the vulnerability CVE-2022-47986 affecting IBM Aspera Faspex has also been exploited in the wild.","CVE-2022-47986 vulnerability","Multiple Industries","CC","US","Link"
"71","22/02/2023","-","-","?","Multiple organizations","Researchers from ReversingLabs discover 41 malicious packages on Python Package Index that mimic popular libraries","Malware","Multiple Industries","CC",">1","Link"
"72","22/02/2023","'Recently'","'Recently'","?","Crum & Forster (C&F)","Crum & Forster (C&F) files notice of a data breach after confirming that an unauthorized party was able to access confidential consumer data as a result of a successful cyberattack.","Unknown","Finance and insurance","CC","US","Link"
"73","22/02/2023","28/02/2023","28/02/2023","Hive","Alvaria","Alvaria files notice of a data breach after confirming that a recent cybersecurity event was a Hive ransomware attack resulting in confidential employee information being leaked.","Malware","Professional, scientific and technical","CC","US","Link"
"74","22/02/2023","17/02/2023","17/02/2023","ALPHV AKA BlackCat","Chile’s National Health Fund (FONASA)","Chile’s National Health Fund (FONASA) reveals that it suffered a malware attack causing some minor interruptions and delays at its branches.","Malware","Human health and social work","CC","CL","Link"
"75","22/02/2023","27/01/2023","27/01/2023","Ragnar Locker","Associação de Advogados de São Paulo (AASP)","The Ragnar Locker ransomware gang leaks 200 GB of files from the Associação de Advogados de São Paulo (AASP) plus numerous screenshots with personal information after the association denies it was hacked.","Malware","Administration and support service","CC","BR","Link"
"76","23/02/2023","Since February 2022","During February 2023","Russia","Youtube users worldwide","According to watchdog Newsguard, Russia is successfully continuing its online disinformation campaigns, with hundreds of professionally-produced videos making their way on to YouTube.","Coordinated inauthentic Behavior","Individual","CW",">1","Link"
"77","23/02/2023","25/02/2023","25/02/2023","CH01","At least 32 Russian websites","A group of pro-Ukraine hacktivists that goes online with the moniker CH01 deface at least 32 Russian websites to mark a protest over the one-year anniversary of the Russian invasion.","Defacement","Multiple Industries","H","RU","Link"
"78","23/02/2023","Since at least February 2022","End of February 2023","UAC-0056 AKA DEV-0586, UNC2589, Nodaria, or Lorec53","Multiple organizations in Ukraine","The Computer Emergency Response Team of Ukraine (CERT-UA) reveals that Russian state-sponsored threat actors have breached multiple government websites this week using backdoors planted as far back as December 2021.","Targeted Attack","Multiple Industries","CE","UA","Link"
"79","23/02/2023","-","-","Clasiopa","Companies in the materials research sector in Asia","Researchers from Symantec/Broadcom discover a threat group, named Clasiopa, targeting companies in the materials research sector with a unique toolset that includes a custom remote access trojan (RAT) called Atharvan.","Targeted Attack","Professional, scientific and technical","CE","N/A","Link"
"80","23/02/2023","Over the past few months","-","wtfisthat34698409672","macOS users","Researchers from Jamf discover a cryptomining operation targeting macOS with a malicious version of Final Cut Pro that remains largely undetected by antivirus engines.","Malware","Individual","CE",">1","Link"
"81","23/02/2023","Since at least March 2021","Since at least March 2021","Three Dutch individuals","Multiple organizations","The Amsterdam cybercrime police team arrests three men for ransomware activity that generated €2.5 million from extorting small and large organizations in multiple countries.","Malware","Multiple Industries","CC","N/A","Link"
"82","23/02/2023","-","-","?","Government entities","Researchers from Menlo Security uncover an unknown threat actor leveraging an evasive threat campaign distributed via Discord that features the PureCrypter downloader and targeting government entities.","Malware","Public admin and defence, social security","CC","N/A","Link"
