"ID","Date Reported","Date Occurred","Date Discovered","Author","Target","Description","Attack","Target Class","Attack Class","Country","Link"
"1","16/09/2023","05/08/2023","05/08/2023","?","Crypto users in Tik Tok","TikTok is flooded by a surge of fake cryptocurrency giveaways posted to the video-sharing platform, with almost all of the videos pretending to be themes based on Elon Musk, Tesla, or SpaceX.","Scam","Finance and insurance","Cyber Crime",">1","Link"
"2","16/09/2023","-","-","LockBit 3.0","TÜV SÜD","The LockBit ransomware gang claims to have hacked the Italian branch of the TÜV SÜD international service corporation.","Malware","Professional, scientific and technical","Cyber Crime","IT","Link"
"3","18/09/2023","During the first half of 2023","Early 2021","Earth Lusca","Multiple organizations in the government, technology, and telecommunications sectors","Researchers from Trend Micro reveal that a Chinese espionage-focused hacker tracked as 'Earth Lusca' was observed targeting government agencies in multiple countries, using a new Linux backdoor dubbed 'SprySOCKS.'","Targeted Attack","Multiple Industries","Cyber Espionage",">1","Link"
"4","18/09/2023","Earlier in 2023","Earlier in 2023","APT36 AKA Transparent Tribe, Mythic Leopard","Military or diplomacy in India and Pakistan","Researchers from Sentinel One reveal that the suspected Pakistani threat actor APT36, known as 'Transparent Tribe,' has been observed using at least three Android apps that mimic YouTube to infect devices with their signature remote access trojan dubbed 'CapraRAT.'","Targeted Attack","Public admin and defence, social security","Cyber Espionage","IN PK","Link"
"5","18/09/2023","16/09/2023","16/09/2023","?","City of Pittsburg","The City of Pittsburg is hit with a ransomware attack.","Malware","Public admin and defence, social security","Cyber Crime","US","Link"
"6","18/09/2023","-","-","?","Unknown organization(s)","The Cybersecurity and Infrastructure Security Agency (CISA) adds CVE-2021-3129, a Laravel Ignition vulnerability, to the list of the known exploited vulnerabilities.","CVE-2021-3129 Vulnerability","Unknown","N/A","US","Link"
"7","18/09/2023","-","-","?","Unknown organization(s)","The Cybersecurity and Infrastructure Security Agency (CISA) adds CVE-2017-6884, a Zyxel vulnerability, to the list of the known exploited vulnerabilities.","CVE-2017-6884 Vulnerability","Unknown","N/A","US","Link"
"8","18/09/2023","-","-","?","Unknown organization(s)","The Cybersecurity and Infrastructure Security Agency (CISA) adds CVE-2014-8361, a Realtek vulnerability, to the list of the known exploited vulnerabilities.","CVE-2014-8361 Vulnerability","Unknown","N/A","US","Link"
"9","18/09/2023","-","-","?","Unknown organization(s)","The Cybersecurity and Infrastructure Security Agency (CISA) adds CVE-2022-22265 , a Samsung vulnerability, to the list of the known exploited vulnerabilities.","CVE-2022-22265 Vulnerability","Unknown","N/A","US","Link"
"10","18/09/2023","-","18/09/2023","Rhysida","Ministry of Finance of Kuwait","The Ministry of Finance of Kuwait is hit by a cyber attack. The Rhysida ransomware gang claims responsibility for the attack.","Malware","Public admin and defence, social security","Cyber Crime","KW","Link"
"11","18/09/2023","Between May and July 2023","Between May and July 2023","?","Crypto investors","Researchers from Sophos discover a new ‘pig butchering’ cryptocurrency scam campaign, stealing more than $1m to the victims in three months.","Scam","Fintech","Cyber Crime",">1","Link"
"12","18/09/2023","Since at least May 2023","Since at least May 2023","Hafnium","E-commerce sites in North and Latin America","Researchers from Blackberry discover 'Silent Skimmer', a web skimming campaign carried out by the Chinese threat actor Hafnium, and targeting e-commerce sites in North and Latin America.","Malicious Script Injection","Wholesale and retail","Cyber Crime",">1","Link"
"13","18/09/2023","Since at least May 2022","-","Threat actors from Indonesia","Multiple organizations","Researchers from Sysdig discover AMBERSQUID, a cloud-native cryptojacking operation targeting uncommon Amazon Web Services (AWS) services such as AWS Amplify, AWS Fargate, and Amazon SageMaker to illicitly mine cryptocurrency.","Malicious Docker Images","Multiple Industries","Cyber Crime",">1","Link"
"14","18/09/2023","-","-","8BASE","Araújo e Policastro Advogados","The 8BASE ransomware gang lists the Brazilian law firm Araújo e Policastro Advogados among their victims.","Malware","Professional, scientific and technical","Cyber Crime","BR","Link"
"15","18/09/2023","-","-","?","Virginia Department of Medical Assistance Services","The Virginia Department of Medical Assistance Services (DMAS) files a notice of data breach.","Unknown","Human health and social work","Cyber Crime","US","Link"
"16","18/09/2023","30/08/2023","30/08/2023","Medusa","Municipality of Betton","The Municipality of Betton suffers a Medusa ransomware attack.","Malware","Public admin and defence, social security","Cyber Crime","FR","Link"
"17","18/09/2023","-","04/09/2023","ThreeAM (AKA 3AM)","Visiting Physician’s Network","Visiting Physician’s Network (VPN) is added to the list of the ThreeAM ransomware group.","Malware","Human health and social work","Cyber Crime","US","Link"
"18","19/09/2023","'Recently'","'Recently'","ShroudedSnooper","Telecommunication service providers in the Middle East","Researchers from Cisco Talos discover two new malware strains named HTTPSnoop and PipeSnoop, used in cyberattacks on telecommunication service providers in the Middle East.","Targeted Attack","Information and communication","Cyber Espionage",">1","Link"
"19","19/09/2023","Mid-September 2023","Mid-September 2023","?","The International Criminal Court (ICC)","The International Criminal Court (ICC) discloses a cyberattack after discovering that its systems had been breached during the previous week.","Unknown","Extraterritorial orgs and bodies","N/A","INT","Link"
"20","19/09/2023","-","-","?","Unknown organization(s)","Trend Micro fixes CVE-2023-41179, a remote code execution zero-day vulnerability in the Trend Micro's Apex One endpoint protection solution, actively exploited in attacks.","CVE-2023-41179 Vulnerability","Unknown","N/A","N/A","Link"
"21","19/09/2023","Since at least 18/09/2023","18/09/2023","?","Users of the crypto lender Celsius","Scammers are impersonating Stretto, the bankruptcy claim agent for crypto lender Celsius in phishing attacks that attempt to steal funds from cryptocurrency wallets.","Account Takeover","Fintech","Cyber Crime",">1","Link"
"22","19/09/2023","Since 21/08/2023","End of August 2023","whalersplonk","Other cyber criminals or security researchers","Researchers from Palo Alto Networks reveal that an attacker is spreading a fake proof-of-concept (PoC) exploit for CVE-2023-40477, a recently fixed WinRAR vulnerability on GitHub, attempting to infect downloaders with the VenomRAT malware.","Malware","Individual","Cyber Crime",">1","Link"
"23","19/09/2023","Since at least 12/09/2023","12/09/2023","?","Multiple organizations","Researchers from Sonatype and Phylum discover a stream of malicious npm and PyPi packages stealing a wide range of sensitive data from software developers on the platforms.","Malware","Multiple Industries","Cyber Crime",">1","Link"
"24","19/09/2023","15/09/2023","15/09/2023","NoName057(16)","Canada Border Services Agency (CBSA)","The Canada Border Services Agency (CBSA) is hit with a DDoS attack. The Pro-Russia collective NoName057(16) claims responsibility for the attack.","DDoS","Public admin and defence, social security","Hacktivism","CA","Link"
"25","19/09/2023","15/09/2023","15/09/2023","NoName057(16)","Canadian Air Transport Security Authority","The Canadian Air Transport Security Authority is hit with a DDoS attack. The Pro-Russia collective NoName057(16) claims responsibility for the attack.","DDoS","Transportation and storage","Hacktivism","CA","Link"
"26","19/09/2023","15/09/2023","15/09/2023","NoName057(16)","Government institutions in Canada","Some Government institutions in Canada are hit with a DDoS attack. The Pro-Russia collective NoName057(16) claims responsibility for the attack.","DDoS","Public admin and defence, social security","Hacktivism","CA","Link"
"27","19/09/2023","15/09/2023","15/09/2023","NoName057(16)","Financial institutions in Canada","Some Financial institutions in Canada are hit with a DDoS attack. The Pro-Russia collective NoName057(16) claims responsibility for the attack.","DDoS","Finance and insurance","Hacktivism","CA","Link"
"28","19/09/2023","-","-","?","Unknown organization(s)","The Cybersecurity and Infrastructure Security Agency (CISA) adds CVE-2023-28434, a MinIO vulnerability, to the list of the known exploited vulnerabilities.","CVE-2023-28434 Vulnerability","Unknown","N/A","US","Link"
"29","19/09/2023","-","03/08/2023","?","Campbell Soup","In its annual report with the Securities and Exchange Commission, Campbell Soup says it discovered a cyber intrusion in part of its IT network.","Unknown","Accommodation and food service","Cyber Crime","US","Link"
"30","19/09/2023","Since at least April 2023","-","TAG-74","South Korean academic, political, and government organizations","Researchers from Recorded Future discover a ""multi-year"" Chinese state-sponsored cyber espionage campaign targeting South Korean academic, political, and government organizations.","Targeted Attack","Public admin and defence, social security","Cyber Espionage","KR","Link"
"31","19/09/2023","'Recently'","'Recently'","?","Multiple organizations","Researchers from Checkmarx discover a malicious Python package, “Culturestreak”, able to hijack system resources for unauthorized cryptocurrency mining.","Malware","Multiple Industries","Cyber Crime",">1","Link"
"32","19/09/2023","-","-","XWorm","Multiple organizations","Researchers at Any.run discover a new version of the XWorm malware.","Malware","Multiple Industries","Cyber Crime",">1","Link"
"33","19/09/2023","-","07/08/2023","Clop AKA Lace Tempest, TA505, and FIN11","St. Luke’s Health System","St. Luke’s Health System issues a notice saying that it had been notified by Nuance of the MOVEit breach, affecting 4,679 of their patients.","CVE-2023-34362 Vulnerability","Human health and social work","Cyber Crime","US","Link"
"34","19/09/2023","-","-","?","Jerusalem Mental Health Center","The Kfar Shaul Mental Health Center and the Eitanim psychiatric hospital, both part of Jerusalem Mental Health Center, are hit with a cyber attack.","Unknown","Human health and social work","Cyber Crime","IL","Link"
"35","20/09/2023","-","17/09/2023","USDoD","Unknown organization","Credit reporting firm TransUnion denies claims of a security breach after a threat actor known as USDoD leaked data allegedly stolen from the company's network.","Unknown","Unknown","Cyber Crime","N/A","Link"
"36","20/09/2023","Since 28/08/2023","Since 28/08/2023","P2PInfect","Multiple organizations in China, the United States, Germany, the United Kingdom, Singapore, Hong Kong and Japan","Researchers from Cado Security discover a 600x increase in malicious traffic by the  P2Pinfect botnet.","Malware","Multiple Industries","Cyber Crime","CN DE JP HK SG US","Link"
"37","20/09/2023","-","-","?","Air Canada","Air Canada discloses a cyber security incident in which hackers ""briefly"" obtained limited access to its internal systems.","Unknown","Transportation and storage","Cyber Crime","CA","Link"
"38","20/09/2023","Since mid-2021","Since mid-2021","Snatch","Organizations in the agriculture, IT and defense industries in the U.S.","The FBI and Cybersecurity and Infrastructure Security Agency (CISA) publish a warning on the activities of the Snatch ransomware gang targeting organizations in the agriculture, IT and defense industries in the U.S.","Malware","Multiple Industries","Cyber Crime","US","Link"
"39","20/09/2023","20/09/2023","20/09/2023","?","Donald Trump Jr.'s Twitter (X) account","The social media account of the former US President's son is apparently hacked and publishes some offensive posts, including that his dad had passed away.","Account Takeover","Individual","Cyber Crime","US","Link"
"40","20/09/2023","17/09/2023","17/09/2023","?","Destiny 2","Bungie reveals hat the login problems that hit Destiny 2 players over the weekend were actually due to a DDoS attack that slowed down the service.","DDoS","Arts entertainment, recreation","Cyber Crime","US","Link"
"41","20/09/2023","-","-","LUCR-3 (overlapping with Scattered Spider, Oktapus, UNC3944, and STORM-0875)","Fortune 2000 companies across various sectors, including Software, Retail, Hospitality, Manufacturing, and Telecoms.","Researchers from Permiso reveal the details of LUCR-3, a threat actor overlapping with Scattered Spider, Oktapus, UNC3944, and STORM-0875, targeting Fortune 2000 companies in different verticals.","Account Takeover","Multiple Industries","Cyber Crime",">1","Link"
"42","20/09/2023","'Recently'","'Recently'","?","Banking users in Mexico and Brazil","Researchers from Check Point discover a new campaign targeting Banking users in Mexico and Brazil through a variant of the BBTok malware.","Malware","Finance and insurance","Cyber Crime","BR MX","Link"
"43","20/09/2023","07/03/2023","-","Vice Society","Lakeland Community College","Lakeland Community College notifies 290,000 people of a data breach that may have compromised their personal, financial and health information. The Vice Society ransomware group claimed responsibility for the attack.","Malware","Education","Cyber Crime","US","Link"
"44","20/09/2023","During 2023","During 2023","?","Android users in Singapore","Police in SIngapore issues an advisory about a new Android scam, where attackers would initiate a factory reset on the infected devices after the malware executes unauthorised transactions on the phone’s i-banking app.","Malware","Finance and insurance","Cyber Crime","SG","Link"
"45","20/09/2023","Since 2009","-","U.S.","Huawei","China's Ministry of State Security (MSS) accuses the U.S. of breaking into Huawei's servers, stealing critical data, and implanting backdoors since 2009.","Targeted Attack","Professional, scientific and technical","Cyber Espionage","CN","Link"
"46","20/09/2023","Since early 2023","Since early 2023","?","Chinese-language speakers","Researchers from Proofpoint discover multiple campaigns targeting Chinese-language speakers. and distributing various malware families such as Sainbox RAT, Purple Fox, and a new trojan called ValleyRAT.","Malware","Individual","Cyber Crime","CN","Link"
"47","20/09/2023","-","-","Cyber Avengers","Israeli Railways","The pro-Iranian Cyber Avengers hacktivist group claims to have hit the Israeli Railways, supposedly revealing information about the electrical infrastructure of the country's railroad network.","Unknown","Transportation and storage","Hacktivism","IL","Link"
"48","20/09/2023","Between 2020 and July 2022","Between 2020 and July 2022","Gold Melody (AKA UNC961 and Prophet Spider)","Multiple organizations","Researchers from Secureworks reveal the details of Gold Melody, a financially motivated threat actor using known vulnerabilities, ordinary TTPs, and off-the-shelf tools to exploit unpatched servers.","Multiple vulnerabilities","Multiple Industries","Cyber Crime",">1","Link"
"49","20/09/2023","-","-","?","BMO Bank","BMO Bank files a notice of data breach after discovering that information entrusted to the company was accessible to an unauthorized party.","Unknown","Finance and insurance","Cyber Crime","US","Link"
"50","20/09/2023","During November 2022","During November 2022","?","Crown Point Community School","Crown Point Community School reveals to have been the victim of a ransomware attack costing $1M to resolve.","Malware","Education","Cyber Crime","US","Link"
"51","20/09/2023","20/09/2023","20/09/2023","?","Balancer","Balancer, an ethereum-based automated market maker, on suffers a security breach that resulted in a loss of $238,000, attributing the compromise to a social engineering attack on the domain registrar EuroDNS.","Account Takeover","Fintech","Cyber Crime","N/A","Link"
"52","21/09/2023","-","-","?","Unknown organization(s)","Apple releases emergency security updates to patch CVE-2023-41991, CVE-2023-41992, and CVE-2023-41993, three new zero-day vulnerabilities exploited in attacks targeting iPhone and Mac users.","CVE-2023-41991, CVE-2023-41992, CVE-2023-41993 Vulnerabilities","Unknown","N/A","N/A","Link"
"53","21/09/2023","During August 2023","Since at least August 2023","Sandman","Telecommunication service providers in the Middle East, Western Europe, and South Asia","Researchers from SentinelOne and QGroup GmbH discover a previously unknown threat actor dubbed 'Sandman' targeting telecommunication service providers in the Middle East, Western Europe, and South Asia, using a modular info-stealing malware named 'LuaDream.'","Targeted Attack","Information and communication","Cyber Espionage",">1","Link"
"54","21/09/2023","21/09/2023","21/09/2023","Russian threat actors","Government of Bermuda","The Government of British overseas territory Bermuda has linked a cyberattack affecting all its departments' IT systems since Thursday to hackers based out of Russia.","Unknown","Public admin and defence, social security","N/A","BM","Link"
"55","21/09/2023","During November 2021","During November 2021","?","Marymount Manhattan College (MMC)","Marymount Manhattan College (MMC) if forced to invest $3.5 million in cybersecurity after a breach affecting 200,000 individuals following a ransomware attack.","Malware","Education","Cyber Crime","US","Link"
"56","21/09/2023","-","20/09/2023","?","Auckland University of Technology","The Auckland University of Technology is hit with a Monti ransomware attack.","Malware","Education","Cyber Crime","NZ","Link"
"57","21/09/2023","-","-","ALPHV AKA BlackCat","Progressive Leasing","Progressive Leasing discloses a ransomware attack. The ALPHV ransomware gang claims responsibility for the attack.","Malware","Finance and insurance","Cyber Crime","US","Link"
"58","21/09/2023","14/09/2023","-","?","City of Fort Lauderdale","The Fort Lauderdale Police Department investigates a financial fraud incident involving the City of Fort Lauderdale, which lost $1.2 million dollars in a phishing scam.","Account Takeover","Public admin and defence, social security","Cyber Crime","US","Link"
"59","21/09/2023","During 2023","During 2023","APT29","Foreign embassies in Ukraine","Researchers from Mandiant and Google’s Threat Analysis Group (TAG) reveal an increase in the frequency and scope of APT29 phishing operations centered on foreign embassies in Ukraine.","Targeted Attack","Public admin and defence, social security","Cyber Espionage",">1","Link"
"60","21/09/2023","'Recently'","'Recently'","?","Customers of hotels, booking sites, and travel agents","Researchers from Akamai discover an infostealer campaign targeting customers of hotels, booking sites, and travel agents.","Malware","Accommodation and food service","Cyber Crime",">1","Link"
"61","21/09/2023","During 2021","During 2021","APT34, AKA OilRig, Cobalt Gypsy, IRN2 and Helix Kitten","Organizations in Israel","Researchers from ESET reveal the details of Outer Space, a campaign carried out by the Iranian threat actor APT34 targeting organizations in Israel during 2021.","Targeted Attack","Multiple Industries","Cyber Espionage","IL","Link"
"62","21/09/2023","During 2022","During 2022","APT34, AKA OilRig, Cobalt Gypsy, IRN2 and Helix Kitten","Organizations in Israel","Researchers from ESET reveal the details of Juicy Mix, a campaign carried out by the Iranian threat actor APT34 targeting organizations in Israel during 2022.","Targeted Attack","Multiple Industries","Cyber Espionage","IL","Link"
"63","21/09/2023","Since at least 2022","During Q2 2023","HiddenGh0st","Multiple organizations","Researchers from AhnLab discover HiddenGh0st, a variant of the Gh0st RAT, distributing the Hidden rootkit and targeting poorly managed MS-SQL servers, and designed to conceal its presence and steal sensitive information.","Malware","Multiple Industries","Cyber Crime",">1","Link"
"64","21/09/2023","-","-","?","Undisclosed company in Pakistan","More than 2 million Pakistani citizens are facing risk of data leak as attackers get access to a private company-made database used by hundreds of restaurants.","Unknown","Professional, scientific and technical","Cyber Crime","PK","Link"
"65","21/09/2023","02/11/2023","-","?","Frax Outsourcing","Frax Outsourcing files a notice of data breach after determining that it was the recent victim of a cyberattack.","Account Takeover","Administration and support service","Cyber Crime","US","Link"
"66","22/09/2023","-","21/09/2023","?","T-Mobile authorized retailer","T-Mobile denies suffering another data breach following reports that a threat actor dubbed 'emo' leaked a large database (89 GB ZIP archive) allegedly containing T-Mobile employees’ data, pointing the finger to an authorized retailer.","Unknown","Wholesale and retail","Cyber Crime","US","Link"
"67","22/09/2023","-","20/09/2023","?","Nansen","Ethereum blockchain analytics firm Nansen asks a subset of its users to reset passwords following a recent data breach at its authentication provider.","Account Takeover","Finance and insurance","Cyber Crime","SG","Link"
"68","22/09/2023","During August and September 2023","-","?","Former Egyptian MP Ahmed Eltantawy","Security researchers with the Citizen Lab and Google's Threat Analysis Group (TAG) reveal that three zero-days vulnerabilities patched by Apple (CVE-2023-41991, CVE-2023-41992, and CVE-2023-41993) were abused as part of an exploit chain to install Cytrox's Predator spyware to target former Egyptian MP Ahmed Eltantawy.","Targeted Attack","Individual","Cyber Espionage","EG","Link"
"69","22/09/2023","Six months between 2022 and 2023.","-","Gelsemium","Governmental entities in Southeast Asia","Researchers from Palo Alto discover a new campaign by the advanced persistent threat (APT) tracked as Gelsemium targeting a Southeast Asian government.","Targeted Attack","Public admin and defence, social security","Cyber Espionage","N/A","Link"
"70","22/09/2023","-","-","Stealth Falcon (aka Project Raven or FruityArmor)","Government agency in the Middle East","Researchers from ESET discover a novel and sophisticated backdoor malware named 'Deadglyph' used in a cyberespionage attack against a government agency in the Middle East by the Stealth Falcon APT, a state-sponsored group from the United Arab Emirates (UAE).","Targeted Attack","Public admin and defence, social security","Cyber Espionage","N/A","Link"
"71","22/09/2023","22/09/2023","22/09/2023","Medusa","Philippine Health Insurance Corporation (PhilHealth)","The Philippine Health Insurance Corporation (PhilHealth), the government organization that manages the universal healthcare system of the Philippines, discovers an information security incident. The Medusa ransomware gang claims responsibility for the attack.","Malware","Human health and social work","Cyber Crime","PH","Link"
"72","22/09/2023","22/09/2023","22/09/2023","?","Multiple Crimean Internet providers","Crimean authorities reveal that their entire internet infrastructure is taken down, causing outages on the peninsula, with multiple Internet providers affected at once.","DDoS","Information and communication","N/A","UA","Link"
"73","22/09/2023","Between 30/05/2023 and 31/05/2023","31/05/2023","Clop AKA Lace Tempest, TA505, and FIN11","Financial Institution Service","Financial Institution Service files a notice of data breach after discovering that the vulnerability in the file-transfer application MOVEit allowed attackers to access the personal information of more than 750,000 people.","CVE-2023-34362 Vulnerability","Finance and insurance","Cyber Crime","US","Link"
"74","22/09/2023","-","-","Clop AKA Lace Tempest, TA505, and FIN11","Johnson Financial Group","Johnson Financial Group files a notice of data breach after discovering that the vulnerability in the file-transfer application MOVEit allowed attackers to access the personal information of more than 750,000 people.","CVE-2023-34362 Vulnerability","Finance and insurance","Cyber Crime","US","Link"
"75","22/09/2023","20/09/2023","","?","Hong Kong Consumer Council","The Hong Kong Consumer Council is hit with a ransomware attack. 25,000 individuals are affected.","Malware","Other service activities","Cyber Crime","HK","Link"
"76","22/09/2023","-","-","EvilBamboo (formerly named Evil Eye)","Tibetan, Uyghur, and Taiwanese individuals and organizations","Researchers from Volexity discover several long-running and currently active campaigns undertaken by the Chinese threat actor tracked as EvilBamboo (formerly named Evil Eye) targeting Tibetan, Uyghur, and Taiwanese individuals and organizations.","Targeted Attack","Multiple Industries","Cyber Espionage","CN TW","Link"
"77","22/09/2023","Since early 2023","Since early 2023","Stately Taurus (AKA Mustang Panda)","Governmental entities in Southeast Asia","Researchers from Palo Alto Networks discover a cluster of malicious cyber espionage activities (tracked as CL-STA-0044), attributed to the well-known Chinese group Stately Taurus (AKA Mustang Panda), targeting Governmental entities in Southeast Asia.","Targeted Attack","Public admin and defence, social security","Cyber Espionage","N/A","Link"
"78","22/09/2023","Since early 2023","Since early 2023","Alloy Taurus (AKA GALLIUM)","Governmental entities in Southeast Asia","Researchers from Palo Alto Networks discover a cluster of malicious cyber espionage activities (tracked as CL-STA-0045), attributed to the well-known Chinese group Alloy Taurus (AKA GALLIUM), targeting Governmental entities in Southeast Asia.","Targeted Attack","Public admin and defence, social security","Cyber Espionage","N/A","Link"
