"ID","Date Reported","Date Occurred","Date Discovered","Author","Target","Description","Attack","Target Class","Attack Class","Country","Link"
"161","29/09/2023","-","29/09/2023","ALPHV AKA BlackCat","McLaren HealthCare","McLaren HealthCare, confirms to be dealing with a ransomware after the BlackCat ransomware group takes credit for the incident. 2.5 million users are affected.","Malware","Human health and social work","Cyber Crime","US","Link"
"162","29/09/2023","Since at least August 2023","During August 2023","APT34, AKA OilRig, Cobalt Gypsy, IRN2 and Helix Kitten","Organizations in Saudi Arabia","Researchers from Trend Micro discover a new cyber espionage campaign by the Iranian threat actor APT34, infecting their victims with the newly discovered Menorah malware.","Targeted Attack","Multiple Industries","Cyber Espionage","SA","Link"
"163","29/09/2023","-","-","?","Unknown organization(s)","Researchers from Cyfirma observe threat actors exploiting the CVE-2023-34468 vulnerability, an RCE vulnerability exploiting Apache NiFi.","CVE-2023-34468 Vulnerability","Unknown","N/A","N/A","Link"
"164","29/09/2023","-","-","?","Cornerstone Home Lending","Cornerstone Home Lending files a notice of data breach after discovering that information provided to the company by consumers was subject to unauthorized access.","Unknown","Finance and insurance","Cyber Crime","US","Link"
"165","29/09/2023","-","13/03/2023","?","Vi Living","Classic Residence Management Limited Partnership d/b/a Vi Living files a notice of data breach after discovering that an unauthorized actor was able to gain access to the company’s computer system.","Unknown","Human health and social work","Cyber Crime","US","Link"
"166","29/09/2023","14/12/2022","14/12/2022","?","Builders Mutual Insurance Company","Builders Mutual Insurance Company files a notice of data breach after discovering that an unauthorized party was able to access the company’s computer network.","Unknown","Finance and insurance","Cyber Crime","US","Link"
"167","29/09/2023","28/06/2023","Recently'","?","API Financial Solutions","API Financial Solutions files a notice of data breach after discovering that an unauthorized party accessed the company’s computer network.","Unknown","Finance and insurance","Cyber Crime","US","Link"
"168","29/09/2023","27/09/2023","13/09/2023","?","Mount Graham Regional Medical Center","Mount Graham Regional Medical Center (MGRMC) files a notice of data breach after confirming a recent ransomware attack.","Malware","Human health and social work","Cyber Crime","US","Link"
"169","29/09/2023","29/09/2023","29/09/2023","NoName057(16)","Multiple organizations in Italy","The pro-Russian collective NoName057(16) takes down the websites of the Italian Securities and Exchange Commission (CONSOB), Italian Association of Financial Intermediaries (ASSOSIM), Commissariat General for Market and Competition (AGCM), Italian National Association of Financial Planners (ANASF)","DDoS","Finance and insurance","Hacktivism","IT","Link"
"170","29/09/2023","02/07/2023","31/07/2023","?","Physio Logic Chiropractic and Physical Therapy, Physio Logic Medicine, and Dr. Patty DiBlasio","Patients of Physio Logic Chiropractic and Physical Therapy, Physio Logic Medicine, and Dr. Patty DiBlasio have some of their protected health information exposed in a cyberattack","Unknown","Human health and social work","Cyber Crime","US","Link"
"171","29/09/2023","-","-","?","Georgia Northside Ear, Nose, and Throat","Georgia Northside Ear, Nose, and Throat files a notice of data breach after discovering that an unauthorized party was able to access confidential information that had been entrusted to the company.","Unknown","Human health and social work","Cyber Crime","US","Link"
"172","30/09/2023","-","-","ALPHV AKA BlackCat","Motel One","The ALPHV/BlackCat ransomware gang adds the hotel chain Motel One to the list of victims.","Malware","Accommodation and food service","Cyber Crime","DE","Link"
"173","30/09/2023","26/09/2023","-","?","Innovery","Innovery, an Italian company delivering IT services, is hit with a cyber attack.","Unknown","Professional, scientific and technical","Cyber Crime","IT","Link"